logs/resnet-18-NHWC-B1-metal.json
{"i": [["[\"fa4c3d5eeba4788b97d02196b9eace76\", [1, 7, 7, 512], [3, 3, 512, 512], [1, 7, 7, 512], [1, 1, 1, 512], [1, 1, 1, 512], [1, 7, 7, 512]]", "metal -keys=metal,gpu -max_function_args=31 -max_num_threads=256 -thread_warp_size=16", [-1, 16, 64, 32768, 2147483647, 1024, 2, 8], "llvm -keys=cpu -link-params=0 -mcpu=apple-m1 -mtriple=arm64-apple-darwin21.3.0", 0, []], [[], [["CI", 17], ["CI", 15], ["CI", 13], ["CI", 11], ["AN", 10, 0, 1], ["AN", 10, 1, 1], ["SP", 10, 2, 16, [2], 1], ["SP", 10, 4, 512, [8], 1], ["AN", 10, 6, 1], ["AN", 10, 7, 1], ["RE", 10, [2, 4, 3, 5, 0, 1, 6, 7]], ["CI", 9], ["CHW", 8, "local"], ["SP", 8, 0, 4, [1, 1, 2, 1], 1], ["SP", 8, 5, 4, [1, 1, 1, 1], 1], ["SP", 8, 10, 16, [1, 4, 2, 2], 1], ["SP", 8, 15, 512, [1, 4, 1, 4], 1], ["SP", 8, 20, 512, [1, 2], 1], ["RE", 8, [0, 5, 10, 15, 1, 6, 11, 16, 2, 7, 12, 17, 20, 21, 3, 8, 13, 18, 22, 4, 9, 14, 19]], ["FSP", 9, 0, 13, 3], ["FSP", 9, 4, 14, 3], ["FSP", 9, 8, 15, 3], ["FSP", 9, 12, 16, 3], ["RE", 9, [0, 4, 8, 12, 1, 5, 9, 13, 2, 6, 10, 14, 3, 7, 11, 15]], ["CA", 8, 9, 11], ["CHR", 7, "shared", [8]], ["CA", 8, 9, 12], ["CHW", 7, "local"], ["SP", 7, 0, 4, [2, 1, 1, 2], 1], ["SP", 7, 5, 4, [1, 1, 1, 4], 1], ["SP", 7, 10, 512, [1, 32, 2, 1], 1], ["SP", 7, 15, 512, [1, 2, 1, 2], 1], ["SP", 7, 20, 3, [1, 1], 1], ["SP", 7, 23, 3, [3, 1], 1], ["RE", 7, [0, 5, 10, 15, 1, 6, 11, 16, 2, 7, 12, 17, 20, 23, 21, 24, 3, 8, 13, 18, 22, 25, 4, 9, 14, 19]], ["FSP", 8, 0, 28, 3], ["FSP", 8, 4, 29, 3], ["FSP", 8, 8, 30, 3], ["FSP", 8, 12, 31, 3], ["RE", 8, [0, 4, 8, 12, 1, 5, 9, 13, 2, 6, 10, 14, 3, 7, 11, 15]], ["CA", 7, 8, 11], ["CHR", 6, "shared", [7]], ["CA", 7, 8, 13], ["CI", 6], ["CHR", 5, "shared", [8]], ["CA", 6, 9, 13], ["CHR", 4, "shared", [12]], ["CA", 5, 13, 12], ["AN", 4, 0, 1], ["AN", 4, 1, 1], ["SP", 4, 2, 16, [1], 1], ["SP", 4, 4, 512, [16], 1], ["AN", 4, 6, 1], ["AN", 4, 7, 1], ["RE", 4, [2, 4, 3, 5, 0, 1, 6, 7]], ["CI", 3], ["CA", 2, 4, 3], ["CI", 1], ["FU", 24, [0, 1, 2, 3]], ["SP", 24, 0, 25088, [8], 1], ["AN", 24, 0, 5], ["AN", 24, 1, 6], ["FU", 16, [0, 1, 2, 3]], ["SP", 16, 0, 8192, [8], 1], ["AN", 16, 0, 5], ["AN", 16, 1, 6], ["FU", 14, [0, 1, 2, 3]], ["AN", 14, 0, 5], ["FU", 14, [1, 2, 3, 4]], ["AN", 14, 1, 4], ["FU", 14, [2, 3, 4, 5]], ["AN", 14, 2, 6], ["FU", 12, [0, 1, 2, 3]], ["SP", 12, 0, 16, [1], 1], ["AN", 12, 1, 2], ["FFSP", 12, 0, [16, 15, 14, 13], 1, 1], ["AN", 12, 1, 6], ["FU", 11, [0, 1, 2, 3]], ["AN", 11, 0, 5], ["FU", 11, [1, 2, 3, 4]], ["AN", 11, 1, 4], ["FU", 11, [2, 3, 4, 5]], ["AN", 11, 2, 6], ["FU", 9, [0, 1]], ["SP", 9, 0, 12, [6], 1], ["AN", 9, 1, 2], ["FFSP", 9, 0, [31, 30, 29, 28], 1, 1], ["AN", 9, 1, 6], ["FU", 7, [0, 1, 2, 3]], ["SP", 7, 0, 12, [1], 1], ["AN", 7, 1, 2], ["FFSP", 7, 0, [31, 30, 29, 28], 1, 1], ["AN", 7, 1, 6], ["FU", 5, [0, 1, 2, 3]], ["SP", 5, 0, 16, [1], 1], ["AN", 5, 1, 2], ["FFSP", 5, 0, [16, 15, 14, 13], 1, 1], ["AN", 5, 1, 6], ["FU", 4, [0, 1, 2, 3]], ["SP", 4, 0, 8192, [8], 1], ["AN", 4, 0, 5], ["AN", 4, 1, 6], ["PR", 4, 0, "auto_unroll_max_step$16"], ["PR", 10, 0, "auto_unroll_max_step$16"], ["PR", 13, 0, "auto_unroll_max_step$16"], ["PR", 16, 0, "auto_unroll_max_step$16"]]]], "r": [[0.00147996], 0, 1.8868, 1648548671], "v": "v0.6"}
{"i": [["[\"fa4c3d5eeba4788b97d02196b9eace76\", [1, 7, 7, 512], [3, 3, 512, 512], [1, 7, 7, 512], [1, 1, 1, 512], [1, 1, 1, 512], [1, 7, 7, 512]]", "metal -keys=metal,gpu -max_function_args=31 -max_num_threads=256 -thread_warp_size=16", [-1, 16, 64, 32768, 2147483647, 1024, 2, 8], "llvm -keys=cpu -link-params=0 -mcpu=apple-m1 -mtriple=arm64-apple-darwin21.3.0", 0, []], [[], [["CI", 17], ["CI", 15], ["CI", 13], ["CI", 11], ["AN", 10, 0, 1], ["AN", 10, 1, 1], ["SP", 10, 2, 16, [2], 1], ["SP", 10, 4, 512, [1], 1], ["AN", 10, 6, 1], ["AN", 10, 7, 1], ["RE", 10, [2, 4, 3, 5, 0, 1, 6, 7]], ["CI", 9], ["CHW", 8, "local"], ["SP", 8, 0, 4, [2, 2, 1, 1], 1], ["SP", 8, 5, 4, [1, 1, 1, 1], 1], ["SP", 8, 10, 16, [1, 4, 4, 1], 1], ["SP", 8, 15, 512, [1, 1, 2, 4], 1], ["SP", 8, 20, 512, [1, 2], 1], ["RE", 8, [0, 5, 10, 15, 1, 6, 11, 16, 2, 7, 12, 17, 20, 21, 3, 8, 13, 18, 22, 4, 9, 14, 19]], ["FSP", 9, 0, 13, 3], ["FSP", 9, 4, 14, 3], ["FSP", 9, 8, 15, 3], ["FSP", 9, 12, 16, 3], ["RE", 9, [0, 4, 8, 12, 1, 5, 9, 13, 2, 6, 10, 14, 3, 7, 11, 15]], ["CA", 8, 9, 11], ["CHR", 7, "shared", [8]], ["CA", 8, 9, 12], ["CHW", 7, "local"], ["SP", 7, 0, 4, [1, 4, 1, 1], 1], ["SP", 7, 5, 4, [2, 2, 1, 1], 1], ["SP", 7, 10, 512, [1, 2, 1, 1], 1], ["SP", 7, 15, 512, [1, 1, 4, 1], 1], ["SP", 7, 20, 3, [1, 1], 1], ["SP", 7, 23, 3, [3, 1], 1], ["RE", 7, [0, 5, 10, 15, 1, 6, 11, 16, 2, 7, 12, 17, 20, 23, 21, 24, 3, 8, 13, 18, 22, 25, 4, 9, 14, 19]], ["FSP", 8, 0, 28, 3], ["FSP", 8, 4, 29, 3], ["FSP", 8, 8, 30, 3], ["FSP", 8, 12, 31, 3], ["RE", 8, [0, 4, 8, 12, 1, 5, 9, 13, 2, 6, 10, 14, 3, 7, 11, 15]], ["CA", 7, 8, 11], ["CHR", 6, "shared", [7]], ["CA", 7, 8, 13], ["CI", 6], ["CHR", 5, "shared", [8]], ["CA", 6, 9, 13], ["CHR", 4, "shared", [12]], ["CA", 5, 13, 12], ["AN", 4, 0, 1], ["AN", 4, 1, 1], ["SP", 4, 2, 16, [4], 1], ["SP", 4, 4, 512, [32], 1], ["AN", 4, 6, 1], ["AN", 4, 7, 1], ["RE", 4, [2, 4, 3, 5, 0, 1, 6, 7]], ["CI", 3], ["CA", 2, 4, 3], ["CI", 1], ["FU", 24, [0, 1, 2, 3]], ["SP", 24, 0, 25088, [8], 1], ["AN", 24, 0, 5], ["AN", 24, 1, 6], ["FU", 16, [0, 1, 2, 3]], ["SP", 16, 0, 8192, [8], 1], ["AN", 16, 0, 5], ["AN", 16, 1, 6], ["FU", 14, [0, 1, 2, 3]], ["AN", 14, 0, 5], ["FU", 14, [1, 2, 3, 4]], ["AN", 14, 1, 4], ["FU", 14, [2, 3, 4, 5]], ["AN", 14, 2, 6], ["FU", 12, [0, 1, 2, 3]], ["SP", 12, 0, 16, [1], 1], ["AN", 12, 1, 2], ["FFSP", 12, 0, [16, 15, 14, 13], 1, 1], ["AN", 12, 1, 6], ["FU", 11, [0, 1, 2, 3]], ["AN", 11, 0, 5], ["FU", 11, [1, 2, 3, 4]], ["AN", 11, 1, 4], ["FU", 11, [2, 3, 4, 5]], ["AN", 11, 2, 6], ["FU", 9, [0, 1]], ["SP", 9, 0, 0, [1], 1], ["AN", 9, 1, 2], ["FFSP", 9, 0, [31, 30, 29, 28], 1, 1], ["AN", 9, 1, 6], ["FU", 7, [0, 1, 2, 3]], ["SP", 7, 0, 12, [1], 1], ["AN", 7, 1, 2], ["FFSP", 7, 0, [31, 30, 29, 28], 1, 1], ["AN", 7, 1, 6], ["FU", 5, [0, 1, 2, 3]], ["SP", 5, 0, 4, [1], 1], ["AN", 5, 1, 2], ["FFSP", 5, 0, [16, 15, 14, 13], 1, 1], ["AN", 5, 1, 6], ["FU", 4, [0, 1, 2, 3]], ["SP", 4, 0, 8192, [8], 1], ["AN", 4, 0, 5], ["AN", 4, 1, 6], ["PR", 4, 0, "auto_unroll_max_step$512"], ["PR", 10, 0, "auto_unroll_max_step$16"], ["PR", 13, 0, "auto_unroll_max_step$16"], ["PR", 16, 0, "auto_unroll_max_step$1024"]]]], "r": [[0.00168303], 0, 2.23244, 1648548673], "v": "v0.6"}
{"i": [["[\"fa4c3d5eeba4788b97d02196b9eace76\", [1, 7, 7, 512], [3, 3, 512, 512], [1, 7, 7, 512], [1, 1, 1, 512], [1, 1, 1, 512], [1, 7, 7, 512]]", "metal -keys=metal,gpu -max_function_args=31 -max_num_threads=256 -thread_warp_size=16", [-1, 16, 64, 32768, 2147483647, 1024, 2, 8], "llvm -keys=cpu -link-params=0 -mcpu=apple-m1 -mtriple=arm64-apple-darwin21.3.0", 0, []], [[], [["CI", 17], ["CI", 15], ["CI", 13], ["CI", 11], ["AN", 10, 0, 1], ["AN", 10, 1, 1], ["SP", 10, 2, 16, [2], 1], ["SP", 10, 4, 512, [2], 1], ["AN", 10, 6, 1], ["AN", 10, 7, 1], ["RE", 10, [2, 4, 3, 5, 0, 1, 6, 7]], ["CI", 9], ["CHW", 8, "local"], ["SP", 8, 0, 4, [1, 1, 1, 4], 1], ["SP", 8, 5, 4, [1, 1, 1, 1], 1], ["SP", 8, 10, 16, [2, 4, 1, 2], 1], ["SP", 8, 15, 512, [1, 8, 2, 16], 1], ["SP", 8, 20, 512, [1, 1], 1], ["RE", 8, [0, 5, 10, 15, 1, 6, 11, 16, 2, 7, 12, 17, 20, 21, 3, 8, 13, 18, 22, 4, 9, 14, 19]], ["FSP", 9, 0, 13, 3], ["FSP", 9, 4, 14, 3], ["FSP", 9, 8, 15, 3], ["FSP", 9, 12, 16, 3], ["RE", 9, [0, 4, 8, 12, 1, 5, 9, 13, 2, 6, 10, 14, 3, 7, 11, 15]], ["CA", 8, 9, 11], ["CHR", 7, "shared", [8]], ["CA", 8, 9, 12], ["CHW", 7, "local"], ["SP", 7, 0, 4, [1, 1, 4, 1], 1], ["SP", 7, 5, 4, [1, 1, 2, 2], 1], ["SP", 7, 10, 512, [2, 16, 2, 2], 1], ["SP", 7, 15, 512, [1, 2, 2, 2], 1], ["SP", 7, 20, 3, [3, 1], 1], ["SP", 7, 23, 3, [1, 1], 1], ["RE", 7, [0, 5, 10, 15, 1, 6, 11, 16, 2, 7, 12, 17, 20, 23, 21, 24, 3, 8, 13, 18, 22, 25, 4, 9, 14, 19]], ["FSP", 8, 0, 28, 3], ["FSP", 8, 4, 29, 3], ["FSP", 8, 8, 30, 3], ["FSP", 8, 12, 31, 3], ["RE", 8, [0, 4, 8, 12, 1, 5, 9, 13, 2, 6, 10, 14, 3, 7, 11, 15]], ["CA", 7, 8, 11], ["CHR", 6, "shared", [7]], ["CA", 7, 8, 13], ["CI", 6], ["CHR", 5, "shared", [8]], ["CA", 6, 9, 13], ["CHR", 4, "shared", [12]], ["CA", 5, 13, 12], ["AN", 4, 0, 1], ["AN", 4, 1, 1], ["SP", 4, 2, 16, [4], 1], ["SP", 4, 4, 512, [64], 1], ["AN", 4, 6, 1], ["AN", 4, 7, 1], ["RE", 4, [2, 4, 3, 5, 0, 1, 6, 7]], ["CI", 3], ["CA", 2, 4, 3], ["CI", 1], ["FU", 24, [0, 1, 2, 3]], ["SP", 24, 0, 25088, [1], 1], ["AN", 24, 0, 5], ["AN", 24, 1, 6], ["FU", 16, [0, 1, 2, 3]], ["SP", 16, 0, 8192, [8], 1], ["AN", 16, 0, 5], ["AN", 16, 1, 6], ["FU", 14, [0, 1, 2, 3]], ["AN", 14, 0, 5], ["FU", 14, [1, 2, 3, 4]], ["AN", 14, 1, 4], ["FU", 14, [2, 3, 4, 5]], ["AN", 14, 2, 6], ["FU", 12, [0, 1, 2, 3]], ["SP", 12, 0, 128, [1], 1], ["AN", 12, 1, 2], ["FFSP", 12, 0, [16, 15, 14, 13], 1, 1], ["AN", 12, 1, 6], ["FU", 11, [0, 1, 2, 3]], ["AN", 11, 0, 5], ["FU", 11, [1, 2, 3, 4]], ["AN", 11, 1, 4], ["FU", 11, [2, 3, 4, 5]], ["AN", 11, 2, 6], ["FU", 9, [0, 1]], ["SP", 9, 0, 12, [1], 1], ["AN", 9, 1, 2], ["FFSP", 9, 0, [31, 30, 29, 28], 1, 1], ["AN", 9, 1, 6], ["FU", 7, [0, 1, 2, 3]], ["SP", 7, 0, 48, [1], 1], ["AN", 7, 1, 2], ["FFSP", 7, 0, [31, 30, 29, 28], 1, 1], ["AN", 7, 1, 6], ["FU", 5, [0, 1, 2, 3]], ["SP", 5, 0, 8, [1], 1], ["AN", 5, 1, 2], ["FFSP", 5, 0, [16, 15, 14, 13], 1, 1], ["AN", 5, 1, 6], ["FU", 4, [0, 1, 2, 3]], ["SP", 4, 0, 8192, [8], 1], ["AN", 4, 0, 5], ["AN", 4, 1, 6], ["PR", 4, 0, "auto_unroll_max_step$512"], ["PR", 10, 0, "auto_unroll_max_step$1024"], ["PR", 13, 0, "auto_unroll_max_step$64"], ["PR", 16, 0, "auto_unroll_max_step$16"]]]], "r": [[0.0228196], 0, 3.35634, 1648548675], "v": "v0.6"}
{"i": [["[\"fa4c3d5eeba4788b97d02196b9eace76\", [1, 7, 7, 512], [3, 3, 512, 512], [1, 7, 7, 512], [1, 1, 1, 512], [1, 1, 1, 512], [1, 7, 7, 512]]", "metal -keys=metal,gpu -max_function_args=31 -max_num_threads=256 -thread_warp_size=16", [-1, 16, 64, 32768, 2147483647, 1024, 2, 8], "llvm -keys=cpu -link-params=0 -mcpu=apple-m1 -mtriple=arm64-apple-darwin21.3.0", 0, []], [[], [["CI", 17], ["CI", 15], ["CI", 13], ["CI", 11], ["AN", 10, 0, 1], ["AN", 10, 1, 1], ["SP", 10, 2, 16, [1], 1], ["SP", 10, 4, 512, [16], 1], ["AN", 10, 6, 1], ["AN", 10, 7, 1], ["RE", 10, [2, 4, 3, 5, 0, 1, 6, 7]], ["CI", 9], ["CHW", 8, "local"], ["SP", 8, 0, 4, [1, 1, 4, 1], 1], ["SP", 8, 5, 4, [1, 1, 1, 1], 1], ["SP", 8, 10, 16, [2, 1, 1, 1], 1], ["SP", 8, 15, 512, [1, 32, 2, 1], 1], ["SP", 8, 20, 512, [1, 8], 1], ["RE", 8, [0, 5, 10, 15, 1, 6, 11, 16, 2, 7, 12, 17, 20, 21, 3, 8, 13, 18, 22, 4, 9, 14, 19]], ["FSP", 9, 0, 13, 3], ["FSP", 9, 4, 14, 3], ["FSP", 9, 8, 15, 3], ["FSP", 9, 12, 16, 3], ["RE", 9, [0, 4, 8, 12, 1, 5, 9, 13, 2, 6, 10, 14, 3, 7, 11, 15]], ["CA", 8, 9, 11], ["CHR", 7, "shared", [8]], ["CA", 8, 9, 12], ["CHW", 7, "local"], ["SP", 7, 0, 4, [2, 1, 1, 2], 1], ["SP", 7, 5, 4, [1, 1, 4, 1], 1], ["SP", 7, 10, 512, [1, 1, 16, 2], 1], ["SP", 7, 15, 512, [1, 8, 1, 1], 1], ["SP", 7, 20, 3, [1, 3], 1], ["SP", 7, 23, 3, [1, 3], 1], ["RE", 7, [0, 5, 10, 15, 1, 6, 11, 16, 2, 7, 12, 17, 20, 23, 21, 24, 3, 8, 13, 18, 22, 25, 4, 9, 14, 19]], ["FSP", 8, 0, 28, 3], ["FSP", 8, 4, 29, 3], ["FSP", 8, 8, 30, 3], ["FSP", 8, 12, 31, 3], ["RE", 8, [0, 4, 8, 12, 1, 5, 9, 13, 2, 6, 10, 14, 3, 7, 11, 15]], ["CA", 7, 8, 11], ["CHR", 6, "shared", [7]], ["CA", 7, 8, 13], ["CI", 6], ["CHR", 5, "shared", [8]], ["CA", 6, 9, 13], ["CHR", 4, "shared", [12]], ["CA", 5, 13, 12], ["AN", 4, 0, 1], ["AN", 4, 1, 1], ["SP", 4, 2, 16, [8], 1], ["SP", 4, 4, 512, [64], 1], ["AN", 4, 6, 1], ["AN", 4, 7, 1], ["RE", 4, [2, 4, 3, 5, 0, 1, 6, 7]], ["CI", 3], ["CA", 2, 4, 3], ["CI", 1], ["FU", 24, [0, 1, 2, 3]], ["SP", 24, 0, 25088, [8], 1], ["AN", 24, 0, 5], ["AN", 24, 1, 6], ["FU", 16, [0, 1, 2, 3]], ["SP", 16, 0, 8192, [8], 1], ["AN", 16, 0, 5], ["AN", 16, 1, 6], ["FU", 14, [0, 1, 2, 3]], ["AN", 14, 0, 5], ["FU", 14, [1, 2, 3, 4]], ["AN", 14, 1, 4], ["FU", 14, [2, 3, 4, 5]], ["AN", 14, 2, 6], ["FU", 12, [0, 1, 2, 3]], ["SP", 12, 0, 64, [1], 1], ["AN", 12, 1, 2], ["FFSP", 12, 0, [16, 15, 14, 13], 1, 1], ["AN", 12, 1, 6], ["FU", 11, [0, 1, 2, 3]], ["AN", 11, 0, 5], ["FU", 11, [1, 2, 3, 4]], ["AN", 11, 1, 4], ["FU", 11, [2, 3, 4, 5]], ["AN", 11, 2, 6], ["FU", 9, [0, 1]], ["SP", 9, 0, 12, [1], 1], ["AN", 9, 1, 2], ["FFSP", 9, 0, [31, 30, 29, 28], 1, 1], ["AN", 9, 1, 6], ["FU", 7, [0, 1, 2, 3]], ["SP", 7, 0, 288, [1], 1], ["AN", 7, 1, 2], ["FFSP", 7, 0, [31, 30, 29, 28], 1, 1], ["AN", 7, 1, 6], ["FU", 5, [0, 1, 2, 3]], ["SP", 5, 0, 32, [1], 1], ["AN", 5, 1, 2], ["FFSP", 5, 0, [16, 15, 14, 13], 1, 1], ["AN", 5, 1, 6], ["FU", 4, [0, 1, 2, 3]], ["SP", 4, 0, 8192, [8], 1], ["AN", 4, 0, 5], ["AN", 4, 1, 6], ["PR", 4, 0, "auto_unroll_max_step$0"], ["PR", 10, 0, "auto_unroll_max_step$16"], ["PR", 13, 0, "auto_unroll_max_step$64"], ["PR", 16, 0, "auto_unroll_max_step$64"]]]], "r": [[0.00335761], 0, 1.99199, 1648548677], "v": "v0.6"}
{"i": [["[\"fa4c3d5eeba4788b97d02196b9eace76\", [1, 7, 7, 512], [3, 3, 512, 512], [1, 7, 7, 512], [1, 1, 1, 512], [1, 1, 1, 512], [1, 7, 7, 512]]", "metal -keys=metal,gpu -max_function_args=31 -max_num_threads=256 -thread_warp_size=16", [-1, 16, 64, 32768, 2147483647, 1024, 2, 8], "llvm -keys=cpu -link-params=0 -mcpu=apple-m1 -mtriple=arm64-apple-darwin21.3.0", 0, []], [[], [["CI", 17], ["CI", 15], ["CI", 13], ["CI", 11], ["AN", 10, 0, 1], ["AN", 10, 1, 1], ["SP", 10, 2, 16, [1], 1], ["SP", 10, 4, 512, [16], 1], ["AN", 10, 6, 1], ["AN", 10, 7, 1], ["RE", 10, [2, 4, 3, 5, 0, 1, 6, 7]], ["CI", 9], ["CHW", 8, "local"], ["SP", 8, 0, 4, [1, 1, 4, 1], 1], ["SP", 8, 5, 4, [1, 1, 1, 1], 1], ["SP", 8, 10, 16, [2, 1, 1, 1], 1], ["SP", 8, 15, 512, [1, 32, 2, 1], 1], ["SP", 8, 20, 512, [4, 2], 1], ["RE", 8, [0, 5, 10, 15, 1, 6, 11, 16, 2, 7, 12, 17, 20, 21, 3, 8, 13, 18, 22, 4, 9, 14, 19]], ["FSP", 9, 0, 13, 3], ["FSP", 9, 4, 14, 3], ["FSP", 9, 8, 15, 3], ["FSP", 9, 12, 16, 3], ["RE", 9, [0, 4, 8, 12, 1, 5, 9, 13, 2, 6, 10, 14, 3, 7, 11, 15]], ["CA", 8, 9, 11], ["CHR", 7, "shared", [8]], ["CA", 8, 9, 12], ["CHW", 7, "local"], ["SP", 7, 0, 4, [1, 1, 1, 2], 1], ["SP", 7, 5, 4, [1, 1, 4, 1], 1], ["SP", 7, 10, 512, [1, 8, 2, 2], 1], ["SP", 7, 15, 512, [1, 8, 1, 1], 1], ["SP", 7, 20, 3, [1, 3], 1], ["SP", 7, 23, 3, [1, 3], 1], ["RE", 7, [0, 5, 10, 15, 1, 6, 11, 16, 2, 7, 12, 17, 20, 23, 21, 24, 3, 8, 13, 18, 22, 25, 4, 9, 14, 19]], ["FSP", 8, 0, 28, 3], ["FSP", 8, 4, 29, 3], ["FSP", 8, 8, 30, 3], ["FSP", 8, 12, 31, 3], ["RE", 8, [0, 4, 8, 12, 1, 5, 9, 13, 2, 6, 10, 14, 3, 7, 11, 15]], ["CA", 7, 8, 11], ["CHR", 6, "shared", [7]], ["CA", 7, 8, 13], ["CI", 6], ["CHR", 5, "shared", [8]], ["CA", 6, 9, 13], ["CHR", 4, "shared", [12]], ["CA", 5, 13, 12], ["AN", 4, 0, 1], ["AN", 4, 1, 1], ["SP", 4, 2, 16, [4], 1], ["SP", 4, 4, 512, [32], 1], ["AN", 4, 6, 1], ["AN", 4, 7, 1], ["RE", 4, [2, 4, 3, 5, 0, 1, 6, 7]], ["CI", 3], ["CA", 2, 4, 3], ["CI", 1], ["FU", 24, [0, 1, 2, 3]], ["SP", 24, 0, 25088, [8], 1], ["AN", 24, 0, 5], ["AN", 24, 1, 6], ["FU", 16, [0, 1, 2, 3]], ["SP", 16, 0, 8192, [8], 1], ["AN", 16, 0, 5], ["AN", 16, 1, 6], ["FU", 14, [0, 1, 2, 3]], ["AN", 14, 0, 5], ["FU", 14, [1, 2, 3, 4]], ["AN", 14, 1, 4], ["FU", 14, [2, 3, 4, 5]], ["AN", 14, 2, 6], ["FU", 12, [0, 1, 2, 3]], ["SP", 12, 0, 64, [1], 1], ["AN", 12, 1, 2], ["FFSP", 12, 0, [16, 15, 14, 13], 1, 1], ["AN", 12, 1, 6], ["FU", 11, [0, 1, 2, 3]], ["AN", 11, 0, 5], ["FU", 11, [1, 2, 3, 4]], ["AN", 11, 1, 4], ["FU", 11, [2, 3, 4, 5]], ["AN", 11, 2, 6], ["FU", 9, [0, 1]], ["SP", 9, 0, 12, [1], 1], ["AN", 9, 1, 2], ["FFSP", 9, 0, [31, 30, 29, 28], 1, 1], ["AN", 9, 1, 6], ["FU", 7, [0, 1, 2, 3]], ["SP", 7, 0, 288, [1], 1], ["AN", 7, 1, 2], ["FFSP", 7, 0, [31, 30, 29, 28], 1, 1], ["AN", 7, 1, 6], ["FU", 5, [0, 1, 2, 3]], ["SP", 5, 0, 32, [1], 1], ["AN", 5, 1, 2], ["FFSP", 5, 0, [16, 15, 14, 13], 1, 1], ["AN", 5, 1, 6], ["FU", 4, [0, 1, 2, 3]], ["SP", 4, 0, 8192, [8], 1], ["AN", 4, 0, 5], ["AN", 4, 1, 6], ["PR", 4, 0, "auto_unroll_max_step$0"], ["PR", 10, 0, "auto_unroll_max_step$16"], ["PR", 13, 0, "auto_unroll_max_step$64"], ["PR", 16, 0, "auto_unroll_max_step$64"]]]], "r": [[0.00198357], 0, 1.76574, 1648548678], "v": "v0.6"}
{"i": [["[\"fa4c3d5eeba4788b97d02196b9eace76\", [1, 7, 7, 512], [3, 3, 512, 512], [1, 7, 7, 512], [1, 1, 1, 512], [1, 1, 1, 512], [1, 7, 7, 512]]", "metal -keys=metal,gpu -max_function_args=31 -max_num_threads=256 -thread_warp_size=16", [-1, 16, 64, 32768, 2147483647, 1024, 2, 8], "llvm -keys=cpu -link-params=0 -mcpu=apple-m1 -mtriple=arm64-apple-darwin21.3.0", 0, []], [[], [["CI", 17], ["CI", 15], ["CI", 13], ["CI", 11], ["AN", 10, 0, 1], ["AN", 10, 1, 1], ["SP", 10, 2, 16, [2], 1], ["SP", 10, 4, 512, [2], 1], ["AN", 10, 6, 1], ["AN", 10, 7, 1], ["RE", 10, [2, 4, 3, 5, 0, 1, 6, 7]], ["CI", 9], ["CHW", 8, "local"], ["SP", 8, 0, 4, [1, 2, 1, 1], 1], ["SP", 8, 5, 4, [1, 1, 4, 1], 1], ["SP", 8, 10, 16, [1, 1, 2, 2], 1], ["SP", 8, 15, 512, [2, 4, 2, 8], 1], ["SP", 8, 20, 512, [1, 1], 1], ["RE", 8, [0, 5, 10, 15, 1, 6, 11, 16, 2, 7, 12, 17, 20, 21, 3, 8, 13, 18, 22, 4, 9, 14, 19]], ["FSP", 9, 0, 13, 3], ["FSP", 9, 4, 14, 3], ["FSP", 9, 8, 15, 3], ["FSP", 9, 12, 16, 3], ["RE", 9, [0, 4, 8, 12, 1, 5, 9, 13, 2, 6, 10, 14, 3, 7, 11, 15]], ["CA", 8, 9, 11], ["CHR", 7, "shared", [8]], ["CA", 8, 9, 12], ["CHW", 7, "local"], ["SP", 7, 0, 4, [1, 1, 1, 2], 1], ["SP", 7, 5, 4, [1, 2, 2, 1], 1], ["SP", 7, 10, 512, [1, 8, 1, 32], 1], ["SP", 7, 15, 512, [1, 4, 1, 1], 1], ["SP", 7, 20, 3, [1, 1], 1], ["SP", 7, 23, 3, [1, 3], 1], ["RE", 7, [0, 5, 10, 15, 1, 6, 11, 16, 2, 7, 12, 17, 20, 23, 21, 24, 3, 8, 13, 18, 22, 25, 4, 9, 14, 19]], ["FSP", 8, 0, 28, 3], ["FSP", 8, 4, 29, 3], ["FSP", 8, 8, 30, 3], ["FSP", 8, 12, 31, 3], ["RE", 8, [0, 4, 8, 12, 1, 5, 9, 13, 2, 6, 10, 14, 3, 7, 11, 15]], ["CA", 7, 8, 11], ["CHR", 6, "shared", [7]], ["CA", 7, 8, 13], ["CI", 6], ["CHR", 5, "shared", [8]], ["CA", 6, 9, 13], ["CHR", 4, "shared", [12]], ["CA", 5, 13, 12], ["AN", 4, 0, 1], ["AN", 4, 1, 1], ["SP", 4, 2, 16, [8], 1], ["SP", 4, 4, 512, [4], 1], ["AN", 4, 6, 1], ["AN", 4, 7, 1], ["RE", 4, [2, 4, 3, 5, 0, 1, 6, 7]], ["CI", 3], ["CA", 2, 4, 3], ["CI", 1], ["FU", 24, [0, 1, 2, 3]], ["SP", 24, 0, 25088, [8], 1], ["AN", 24, 0, 5], ["AN", 24, 1, 6], ["FU", 16, [0, 1, 2, 3]], ["SP", 16, 0, 8192, [2], 1], ["AN", 16, 0, 5], ["AN", 16, 1, 6], ["FU", 14, [0, 1, 2, 3]], ["AN", 14, 0, 5], ["FU", 14, [1, 2, 3, 4]], ["AN", 14, 1, 4], ["FU", 14, [2, 3, 4, 5]], ["AN", 14, 2, 6], ["FU", 12, [0, 1, 2, 3]], ["SP", 12, 0, 64, [1], 1], ["AN", 12, 1, 2], ["FFSP", 12, 0, [16, 15, 14, 13], 1, 1], ["AN", 12, 1, 6], ["FU", 11, [0, 1, 2, 3]], ["AN", 11, 0, 5], ["FU", 11, [1, 2, 3, 4]], ["AN", 11, 1, 4], ["FU", 11, [2, 3, 4, 5]], ["AN", 11, 2, 6], ["FU", 9, [0, 1]], ["SP", 9, 0, 0, [1], 1], ["AN", 9, 1, 2], ["FFSP", 9, 0, [31, 30, 29, 28], 1, 1], ["AN", 9, 1, 6], ["FU", 7, [0, 1, 2, 3]], ["SP", 7, 0, 96, [1], 1], ["AN", 7, 1, 2], ["FFSP", 7, 0, [31, 30, 29, 28], 1, 1], ["AN", 7, 1, 6], ["FU", 5, [0, 1, 2, 3]], ["SP", 5, 0, 16, [2], 1], ["AN", 5, 1, 2], ["FFSP", 5, 0, [16, 15, 14, 13], 1, 1], ["AN", 5, 1, 6], ["FU", 4, [0, 1, 2, 3]], ["SP", 4, 0, 8192, [8], 1], ["AN", 4, 0, 5], ["AN", 4, 1, 6], ["PR", 4, 0, "auto_unroll_max_step$512"], ["PR", 10, 0, "auto_unroll_max_step$512"], ["PR", 13, 0, "auto_unroll_max_step$1024"], ["PR", 16, 0, "auto_unroll_max_step$1024"]]]], "r": [[0.0210901], 0, 2.87054, 1648548680], "v": "v0.6"}
{"i": [["[\"fa4c3d5eeba4788b97d02196b9eace76\", [1, 7, 7, 512], [3, 3, 512, 512], [1, 7, 7, 512], [1, 1, 1, 512], [1, 1, 1, 512], [1, 7, 7, 512]]", "metal -keys=metal,gpu -max_function_args=31 -max_num_threads=256 -thread_warp_size=16", [-1, 16, 64, 32768, 2147483647, 1024, 2, 8], "llvm -keys=cpu -link-params=0 -mcpu=apple-m1 -mtriple=arm64-apple-darwin21.3.0", 0, []], [[], [["CI", 17], ["CI", 15], ["CI", 13], ["CI", 11], ["AN", 10, 0, 1], ["AN", 10, 1, 1], ["SP", 10, 2, 16, [8], 1], ["SP", 10, 4, 512, [64], 1], ["AN", 10, 6, 1], ["AN", 10, 7, 1], ["RE", 10, [2, 4, 3, 5, 0, 1, 6, 7]], ["CI", 9], ["CHW", 8, "local"], ["SP", 8, 0, 4, [1, 1, 1, 4], 1], ["SP", 8, 5, 4, [1, 1, 1, 1], 1], ["SP", 8, 10, 16, [2, 8, 1, 1], 1], ["SP", 8, 15, 512, [1, 2, 32, 4], 1], ["SP", 8, 20, 512, [1, 1], 1], ["RE", 8, [0, 5, 10, 15, 1, 6, 11, 16, 2, 7, 12, 17, 20, 21, 3, 8, 13, 18, 22, 4, 9, 14, 19]], ["FSP", 9, 0, 13, 3], ["FSP", 9, 4, 14, 3], ["FSP", 9, 8, 15, 3], ["FSP", 9, 12, 16, 3], ["RE", 9, [0, 4, 8, 12, 1, 5, 9, 13, 2, 6, 10, 14, 3, 7, 11, 15]], ["CA", 8, 9, 11], ["CHR", 7, "shared", [8]], ["CA", 8, 9, 12], ["CHW", 7, "local"], ["SP", 7, 0, 4, [1, 2, 1, 2], 1], ["SP", 7, 5, 4, [2, 1, 2, 1], 1], ["SP", 7, 10, 512, [1, 4, 8, 1], 1], ["SP", 7, 15, 512, [1, 4, 1, 2], 1], ["SP", 7, 20, 3, [1, 3], 1], ["SP", 7, 23, 3, [1, 3], 1], ["RE", 7, [0, 5, 10, 15, 1, 6, 11, 16, 2, 7, 12, 17, 20, 23, 21, 24, 3, 8, 13, 18, 22, 25, 4, 9, 14, 19]], ["FSP", 8, 0, 28, 3], ["FSP", 8, 4, 29, 3], ["FSP", 8, 8, 30, 3], ["FSP", 8, 12, 31, 3], ["RE", 8, [0, 4, 8, 12, 1, 5, 9, 13, 2, 6, 10, 14, 3, 7, 11, 15]], ["CA", 7, 8, 11], ["CHR", 6, "shared", [7]], ["CA", 7, 8, 13], ["CI", 6], ["CHR", 5, "shared", [8]], ["CA", 6, 9, 13], ["CHR", 4, "shared", [12]], ["CA", 5, 13, 12], ["AN", 4, 0, 1], ["AN", 4, 1, 1], ["SP", 4, 2, 16, [2], 1], ["SP", 4, 4, 512, [32], 1], ["AN", 4, 6, 1], ["AN", 4, 7, 1], ["RE", 4, [2, 4, 3, 5, 0, 1, 6, 7]], ["CI", 3], ["CA", 2, 4, 3], ["CI", 1], ["FU", 24, [0, 1, 2, 3]], ["SP", 24, 0, 25088, [16], 1], ["AN", 24, 0, 5], ["AN", 24, 1, 6], ["FU", 16, [0, 1, 2, 3]], ["SP", 16, 0, 8192, [8], 1], ["AN", 16, 0, 5], ["AN", 16, 1, 6], ["FU", 14, [0, 1, 2, 3]], ["AN", 14, 0, 5], ["FU", 14, [1, 2, 3, 4]], ["AN", 14, 1, 4], ["FU", 14, [2, 3, 4, 5]], ["AN", 14, 2, 6], ["FU", 12, [0, 1, 2, 3]], ["SP", 12, 0, 512, [1], 1], ["AN", 12, 1, 2], ["FFSP", 12, 0, [16, 15, 14, 13], 1, 1], ["AN", 12, 1, 6], ["FU", 11, [0, 1, 2, 3]], ["AN", 11, 0, 5], ["FU", 11, [1, 2, 3, 4]], ["AN", 11, 1, 4], ["FU", 11, [2, 3, 4, 5]], ["AN", 11, 2, 6], ["FU", 9, [0, 1]], ["SP", 9, 0, 0, [1], 1], ["AN", 9, 1, 2], ["FFSP", 9, 0, [31, 30, 29, 28], 1, 1], ["AN", 9, 1, 6], ["FU", 7, [0, 1, 2, 3]], ["SP", 7, 0, 96, [1], 1], ["AN", 7, 1, 2], ["FFSP", 7, 0, [31, 30, 29, 28], 1, 1], ["AN", 7, 1, 6], ["FU", 5, [0, 1, 2, 3]], ["SP", 5, 0, 4, [1], 1], ["AN", 5, 1, 2], ["FFSP", 5, 0, [16, 15, 14, 13], 1, 1], ["AN", 5, 1, 6], ["FU", 4, [0, 1, 2, 3]], ["SP", 4, 0, 8192, [8], 1], ["AN", 4, 0, 5], ["AN", 4, 1, 6], ["PR", 4, 0, "auto_unroll_max_step$1024"], ["PR", 10, 0, "auto_unroll_max_step$64"], ["PR", 13, 0, "auto_unroll_max_step$1024"], ["PR", 16, 0, "auto_unroll_max_step$0"]]]], "r": [[0.02317], 0, 3.17918, 1648548682], "v": "v0.6"}
{"i": [["[\"fa4c3d5eeba4788b97d02196b9eace76\", [1, 7, 7, 512], [3, 3, 512, 512], [1, 7, 7, 512], [1, 1, 1, 512], [1, 1, 1, 512], [1, 7, 7, 512]]", "metal -keys=metal,gpu -max_function_args=31 -max_num_threads=256 -thread_warp_size=16", [-1, 16, 64, 32768, 2147483647, 1024, 2, 8], "llvm -keys=cpu -link-params=0 -mcpu=apple-m1 -mtriple=arm64-apple-darwin21.3.0", 0, []], [[], [["CI", 17], ["CI", 15], ["CI", 13], ["CI", 11], ["AN", 10, 0, 1], ["AN", 10, 1, 1], ["SP", 10, 2, 16, [2], 1], ["SP", 10, 4, 512, [1], 1], ["AN", 10, 6, 1], ["AN", 10, 7, 1], ["RE", 10, [2, 4, 3, 5, 0, 1, 6, 7]], ["CI", 9], ["CHW", 8, "local"], ["SP", 8, 0, 4, [1, 2, 1, 1], 1], ["SP", 8, 5, 4, [1, 1, 2, 1], 1], ["SP", 8, 10, 16, [1, 4, 4, 1], 1], ["SP", 8, 15, 512, [2, 2, 1, 32], 1], ["SP", 8, 20, 512, [1, 4], 1], ["RE", 8, [0, 5, 10, 15, 1, 6, 11, 16, 2, 7, 12, 17, 20, 21, 3, 8, 13, 18, 22, 4, 9, 14, 19]], ["FSP", 9, 0, 13, 3], ["FSP", 9, 4, 14, 3], ["FSP", 9, 8, 15, 3], ["FSP", 9, 12, 16, 3], ["RE", 9, [0, 4, 8, 12, 1, 5, 9, 13, 2, 6, 10, 14, 3, 7, 11, 15]], ["CA", 8, 9, 11], ["CHR", 7, "shared", [8]], ["CA", 8, 9, 12], ["CHW", 7, "local"], ["SP", 7, 0, 4, [1, 1, 1, 4], 1], ["SP", 7, 5, 4, [1, 1, 2, 1], 1], ["SP", 7, 10, 512, [1, 2, 2, 2], 1], ["SP", 7, 15, 512, [2, 4, 2, 1], 1], ["SP", 7, 20, 3, [3, 1], 1], ["SP", 7, 23, 3, [3, 1], 1], ["RE", 7, [0, 5, 10, 15, 1, 6, 11, 16, 2, 7, 12, 17, 20, 23, 21, 24, 3, 8, 13, 18, 22, 25, 4, 9, 14, 19]], ["FSP", 8, 0, 28, 3], ["FSP", 8, 4, 29, 3], ["FSP", 8, 8, 30, 3], ["FSP", 8, 12, 31, 3], ["RE", 8, [0, 4, 8, 12, 1, 5, 9, 13, 2, 6, 10, 14, 3, 7, 11, 15]], ["CA", 7, 8, 11], ["CHR", 6, "shared", [7]], ["CA", 7, 8, 13], ["CI", 6], ["CHR", 5, "shared", [8]], ["CA", 6, 9, 13], ["CHR", 4, "shared", [12]], ["CA", 5, 13, 12], ["AN", 4, 0, 1], ["AN", 4, 1, 1], ["SP", 4, 2, 16, [8], 1], ["SP", 4, 4, 512, [8], 1], ["AN", 4, 6, 1], ["AN", 4, 7, 1], ["RE", 4, [2, 4, 3, 5, 0, 1, 6, 7]], ["CI", 3], ["CA", 2, 4, 3], ["CI", 1], ["FU", 24, [0, 1, 2, 3]], ["SP", 24, 0, 25088, [8], 1], ["AN", 24, 0, 5], ["AN", 24, 1, 6], ["FU", 16, [0, 1, 2, 3]], ["SP", 16, 0, 8192, [8], 1], ["AN", 16, 0, 5], ["AN", 16, 1, 6], ["FU", 14, [0, 1, 2, 3]], ["AN", 14, 0, 5], ["FU", 14, [1, 2, 3, 4]], ["AN", 14, 1, 4], ["FU", 14, [2, 3, 4, 5]], ["AN", 14, 2, 6], ["FU", 12, [0, 1, 2, 3]], ["SP", 12, 0, 16, [1], 1], ["AN", 12, 1, 2], ["FFSP", 12, 0, [16, 15, 14, 13], 1, 1], ["AN", 12, 1, 6], ["FU", 11, [0, 1, 2, 3]], ["AN", 11, 0, 5], ["FU", 11, [1, 2, 3, 4]], ["AN", 11, 1, 4], ["FU", 11, [2, 3, 4, 5]], ["AN", 11, 2, 6], ["FU", 9, [0, 1]], ["SP", 9, 0, 12, [1], 1], ["AN", 9, 1, 2], ["FFSP", 9, 0, [31, 30, 29, 28], 1, 1], ["AN", 9, 1, 6], ["FU", 7, [0, 1, 2, 3]], ["SP", 7, 0, 72, [1], 1], ["AN", 7, 1, 2], ["FFSP", 7, 0, [31, 30, 29, 28], 1, 1], ["AN", 7, 1, 6], ["FU", 5, [0, 1, 2, 3]], ["SP", 5, 0, 32, [1], 1], ["AN", 5, 1, 2], ["FFSP", 5, 0, [16, 15, 14, 13], 1, 1], ["AN", 5, 1, 6], ["FU", 4, [0, 1, 2, 3]], ["SP", 4, 0, 8192, [8], 1], ["AN", 4, 0, 5], ["AN", 4, 1, 6], ["PR", 4, 0, "auto_unroll_max_step$16"], ["PR", 10, 0, "auto_unroll_max_step$1024"], ["PR", 13, 0, "auto_unroll_max_step$512"], ["PR", 16, 0, "auto_unroll_max_step$0"]]]], "r": [[0.0381064], 0, 4.66315, 1648548685], "v": "v0.6"}
{"i": [["[\"fa4c3d5eeba4788b97d02196b9eace76\", [1, 7, 7, 512], [3, 3, 512, 512], [1, 7, 7, 512], [1, 1, 1, 512], [1, 1, 1, 512], [1, 7, 7, 512]]", "metal -keys=metal,gpu -max_function_args=31 -max_num_threads=256 -thread_warp_size=16", [-1, 16, 64, 32768, 2147483647, 1024, 2, 8], "llvm -keys=cpu -link-params=0 -mcpu=apple-m1 -mtriple=arm64-apple-darwin21.3.0", 0, []], [[], [["CI", 17], ["CI", 15], ["CI", 13], ["CI", 11], ["AN", 10, 0, 1], ["AN", 10, 1, 1], ["SP", 10, 2, 16, [1], 1], ["SP", 10, 4, 512, [16], 1], ["AN", 10, 6, 1], ["AN", 10, 7, 1], ["RE", 10, [2, 4, 3, 5, 0, 1, 6, 7]], ["CI", 9], ["CHW", 8, "local"], ["SP", 8, 0, 4, [1, 1, 1, 4], 1], ["SP", 8, 5, 4, [2, 1, 2, 1], 1], ["SP", 8, 10, 16, [1, 2, 4, 2], 1], ["SP", 8, 15, 512, [1, 2, 8, 1], 1], ["SP", 8, 20, 512, [2, 4], 1], ["RE", 8, [0, 5, 10, 15, 1, 6, 11, 16, 2, 7, 12, 17, 20, 21, 3, 8, 13, 18, 22, 4, 9, 14, 19]], ["FSP", 9, 0, 13, 3], ["FSP", 9, 4, 14, 3], ["FSP", 9, 8, 15, 3], ["FSP", 9, 12, 16, 3], ["RE", 9, [0, 4, 8, 12, 1, 5, 9, 13, 2, 6, 10, 14, 3, 7, 11, 15]], ["CA", 8, 9, 11], ["CHR", 7, "shared", [8]], ["CA", 8, 9, 12], ["CHW", 7, "local"], ["SP", 7, 0, 4, [1, 1, 1, 1], 1], ["SP", 7, 5, 4, [2, 1, 2, 1], 1], ["SP", 7, 10, 512, [1, 8, 2, 1], 1], ["SP", 7, 15, 512, [1, 4, 32, 1], 1], ["SP", 7, 20, 3, [1, 1], 1], ["SP", 7, 23, 3, [3, 1], 1], ["RE", 7, [0, 5, 10, 15, 1, 6, 11, 16, 2, 7, 12, 17, 20, 23, 21, 24, 3, 8, 13, 18, 22, 25, 4, 9, 14, 19]], ["FSP", 8, 0, 28, 3], ["FSP", 8, 4, 29, 3], ["FSP", 8, 8, 30, 3], ["FSP", 8, 12, 31, 3], ["RE", 8, [0, 4, 8, 12, 1, 5, 9, 13, 2, 6, 10, 14, 3, 7, 11, 15]], ["CA", 7, 8, 11], ["CHR", 6, "shared", [7]], ["CA", 7, 8, 13], ["CI", 6], ["CHR", 5, "shared", [8]], ["CA", 6, 9, 13], ["CHR", 4, "shared", [12]], ["CA", 5, 13, 12], ["AN", 4, 0, 1], ["AN", 4, 1, 1], ["SP", 4, 2, 16, [1], 1], ["SP", 4, 4, 512, [8], 1], ["AN", 4, 6, 1], ["AN", 4, 7, 1], ["RE", 4, [2, 4, 3, 5, 0, 1, 6, 7]], ["CI", 3], ["CA", 2, 4, 3], ["CI", 1], ["FU", 24, [0, 1, 2, 3]], ["SP", 24, 0, 25088, [8], 1], ["AN", 24, 0, 5], ["AN", 24, 1, 6], ["FU", 16, [0, 1, 2, 3]], ["SP", 16, 0, 8192, [8], 1], ["AN", 16, 0, 5], ["AN", 16, 1, 6], ["FU", 14, [0, 1, 2, 3]], ["AN", 14, 0, 5], ["FU", 14, [1, 2, 3, 4]], ["AN", 14, 1, 4], ["FU", 14, [2, 3, 4, 5]], ["AN", 14, 2, 6], ["FU", 12, [0, 1, 2, 3]], ["SP", 12, 0, 512, [1], 1], ["AN", 12, 1, 2], ["FFSP", 12, 0, [16, 15, 14, 13], 1, 1], ["AN", 12, 1, 6], ["FU", 11, [0, 1, 2, 3]], ["AN", 11, 0, 5], ["FU", 11, [1, 2, 3, 4]], ["AN", 11, 1, 4], ["FU", 11, [2, 3, 4, 5]], ["AN", 11, 2, 6], ["FU", 9, [0, 1]], ["SP", 9, 0, 0, [1], 1], ["AN", 9, 1, 2], ["FFSP", 9, 0, [31, 30, 29, 28], 1, 1], ["AN", 9, 1, 6], ["FU", 7, [0, 1, 2, 3]], ["SP", 7, 0, 192, [1], 1], ["AN", 7, 1, 2], ["FFSP", 7, 0, [31, 30, 29, 28], 1, 1], ["AN", 7, 1, 6], ["FU", 5, [0, 1, 2, 3]], ["SP", 5, 0, 512, [1], 1], ["AN", 5, 1, 2], ["FFSP", 5, 0, [16, 15, 14, 13], 1, 1], ["AN", 5, 1, 6], ["FU", 4, [0, 1, 2, 3]], ["SP", 4, 0, 8192, [8], 1], ["AN", 4, 0, 5], ["AN", 4, 1, 6], ["PR", 4, 0, "auto_unroll_max_step$0"], ["PR", 10, 0, "auto_unroll_max_step$16"], ["PR", 13, 0, "auto_unroll_max_step$16"], ["PR", 16, 0, "auto_unroll_max_step$0"]]]], "r": [[0.0261705], 0, 1.71418, 1648548686], "v": "v0.6"}
{"i": [["[\"fa4c3d5eeba4788b97d02196b9eace76\", [1, 7, 7, 512], [3, 3, 512, 512], [1, 7, 7, 512], [1, 1, 1, 512], [1, 1, 1, 512], [1, 7, 7, 512]]", "metal -keys=metal,gpu -max_function_args=31 -max_num_threads=256 -thread_warp_size=16", [-1, 16, 64, 32768, 2147483647, 1024, 2, 8], "llvm -keys=cpu -link-params=0 -mcpu=apple-m1 -mtriple=arm64-apple-darwin21.3.0", 0, []], [[], [["CI", 17], ["CI", 15], ["CI", 13], ["CI", 11], ["AN", 10, 0, 1], ["AN", 10, 1, 1], ["SP", 10, 2, 16, [16], 1], ["SP", 10, 4, 512, [1], 1], ["AN", 10, 6, 1], ["AN", 10, 7, 1], ["RE", 10, [2, 4, 3, 5, 0, 1, 6, 7]], ["CI", 9], ["CHW", 8, "local"], ["SP", 8, 0, 4, [1, 2, 1, 1], 1], ["SP", 8, 5, 4, [1, 1, 2, 1], 1], ["SP", 8, 10, 16, [1, 4, 4, 1], 1], ["SP", 8, 15, 512, [1, 32, 1, 4], 1], ["SP", 8, 20, 512, [1, 4], 1], ["RE", 8, [0, 5, 10, 15, 1, 6, 11, 16, 2, 7, 12, 17, 20, 21, 3, 8, 13, 18, 22, 4, 9, 14, 19]], ["FSP", 9, 0, 13, 3], ["FSP", 9, 4, 14, 3], ["FSP", 9, 8, 15, 3], ["FSP", 9, 12, 16, 3], ["RE", 9, [0, 4, 8, 12, 1, 5, 9, 13, 2, 6, 10, 14, 3, 7, 11, 15]], ["CA", 8, 9, 11], ["CHR", 7, "shared", [8]], ["CA", 8, 9, 12], ["CHW", 7, "local"], ["SP", 7, 0, 4, [1, 1, 1, 4], 1], ["SP", 7, 5, 4, [1, 1, 2, 1], 1], ["SP", 7, 10, 512, [1, 2, 2, 2], 1], ["SP", 7, 15, 512, [2, 4, 2, 1], 1], ["SP", 7, 20, 3, [3, 1], 1], ["SP", 7, 23, 3, [3, 1], 1], ["RE", 7, [0, 5, 10, 15, 1, 6, 11, 16, 2, 7, 12, 17, 20, 23, 21, 24, 3, 8, 13, 18, 22, 25, 4, 9, 14, 19]], ["FSP", 8, 0, 28, 3], ["FSP", 8, 4, 29, 3], ["FSP", 8, 8, 30, 3], ["FSP", 8, 12, 31, 3], ["RE", 8, [0, 4, 8, 12, 1, 5, 9, 13, 2, 6, 10, 14, 3, 7, 11, 15]], ["CA", 7, 8, 11], ["CHR", 6, "shared", [7]], ["CA", 7, 8, 13], ["CI", 6], ["CHR", 5, "shared", [8]], ["CA", 6, 9, 13], ["CHR", 4, "shared", [12]], ["CA", 5, 13, 12], ["AN", 4, 0, 1], ["AN", 4, 1, 1], ["SP", 4, 2, 16, [4], 1], ["SP", 4, 4, 512, [8], 1], ["AN", 4, 6, 1], ["AN", 4, 7, 1], ["RE", 4, [2, 4, 3, 5, 0, 1, 6, 7]], ["CI", 3], ["CA", 2, 4, 3], ["CI", 1], ["FU", 24, [0, 1, 2, 3]], ["SP", 24, 0, 25088, [8], 1], ["AN", 24, 0, 5], ["AN", 24, 1, 6], ["FU", 16, [0, 1, 2, 3]], ["SP", 16, 0, 8192, [8], 1], ["AN", 16, 0, 5], ["AN", 16, 1, 6], ["FU", 14, [0, 1, 2, 3]], ["AN", 14, 0, 5], ["FU", 14, [1, 2, 3, 4]], ["AN", 14, 1, 4], ["FU", 14, [2, 3, 4, 5]], ["AN", 14, 2, 6], ["FU", 12, [0, 1, 2, 3]], ["SP", 12, 0, 16, [1], 1], ["AN", 12, 1, 2], ["FFSP", 12, 0, [16, 15, 14, 13], 1, 1], ["AN", 12, 1, 6], ["FU", 11, [0, 1, 2, 3]], ["AN", 11, 0, 5], ["FU", 11, [1, 2, 3, 4]], ["AN", 11, 1, 4], ["FU", 11, [2, 3, 4, 5]], ["AN", 11, 2, 6], ["FU", 9, [0, 1]], ["SP", 9, 0, 12, [1], 1], ["AN", 9, 1, 2], ["FFSP", 9, 0, [31, 30, 29, 28], 1, 1], ["AN", 9, 1, 6], ["FU", 7, [0, 1, 2, 3]], ["SP", 7, 0, 72, [1], 1], ["AN", 7, 1, 2], ["FFSP", 7, 0, [31, 30, 29, 28], 1, 1], ["AN", 7, 1, 6], ["FU", 5, [0, 1, 2, 3]], ["SP", 5, 0, 32, [1], 1], ["AN", 5, 1, 2], ["FFSP", 5, 0, [16, 15, 14, 13], 1, 1], ["AN", 5, 1, 6], ["FU", 4, [0, 1, 2, 3]], ["SP", 4, 0, 8192, [4], 1], ["AN", 4, 0, 5], ["AN", 4, 1, 6], ["PR", 4, 0, "auto_unroll_max_step$16"], ["PR", 10, 0, "auto_unroll_max_step$1024"], ["PR", 13, 0, "auto_unroll_max_step$512"], ["PR", 16, 0, "auto_unroll_max_step$0"]]]], "r": [[0.00825153], 0, 1.85497, 1648548687], "v": "v0.6"}
{"i": [["[\"fa4c3d5eeba4788b97d02196b9eace76\", [1, 7, 7, 512], [3, 3, 512, 512], [1, 7, 7, 512], [1, 1, 1, 512], [1, 1, 1, 512], [1, 7, 7, 512]]", "metal -keys=metal,gpu -max_function_args=31 -max_num_threads=256 -thread_warp_size=16", [-1, 16, 64, 32768, 2147483647, 1024, 2, 8], "llvm -keys=cpu -link-params=0 -mcpu=apple-m1 -mtriple=arm64-apple-darwin21.3.0", 0, []], [[], [["CI", 17], ["CI", 15], ["CI", 13], ["CI", 11], ["AN", 10, 0, 1], ["AN", 10, 1, 1], ["SP", 10, 2, 16, [2], 1], ["SP", 10, 4, 512, [16], 1], ["AN", 10, 6, 1], ["AN", 10, 7, 1], ["RE", 10, [2, 4, 3, 5, 0, 1, 6, 7]], ["CI", 9], ["CHW", 8, "local"], ["SP", 8, 0, 4, [1, 2, 1, 2], 1], ["SP", 8, 5, 4, [1, 2, 2, 1], 1], ["SP", 8, 10, 16, [1, 1, 1, 16], 1], ["SP", 8, 15, 512, [1, 16, 1, 8], 1], ["SP", 8, 20, 512, [1, 1], 1], ["RE", 8, [0, 5, 10, 15, 1, 6, 11, 16, 2, 7, 12, 17, 20, 21, 3, 8, 13, 18, 22, 4, 9, 14, 19]], ["FSP", 9, 0, 13, 3], ["FSP", 9, 4, 14, 3], ["FSP", 9, 8, 15, 3], ["FSP", 9, 12, 16, 3], ["RE", 9, [0, 4, 8, 12, 1, 5, 9, 13, 2, 6, 10, 14, 3, 7, 11, 15]], ["CA", 8, 9, 11], ["CHR", 7, "shared", [8]], ["CA", 8, 9, 12], ["CHW", 7, "local"], ["SP", 7, 0, 4, [1, 1, 2, 1], 1], ["SP", 7, 5, 4, [1, 1, 4, 1], 1], ["SP", 7, 10, 512, [1, 1, 1, 4], 1], ["SP", 7, 15, 512, [2, 16, 2, 2], 1], ["SP", 7, 20, 3, [1, 3], 1], ["SP", 7, 23, 3, [3, 1], 1], ["RE", 7, [0, 5, 10, 15, 1, 6, 11, 16, 2, 7, 12, 17, 20, 23, 21, 24, 3, 8, 13, 18, 22, 25, 4, 9, 14, 19]], ["FSP", 8, 0, 28, 3], ["FSP", 8, 4, 29, 3], ["FSP", 8, 8, 30, 3], ["FSP", 8, 12, 31, 3], ["RE", 8, [0, 4, 8, 12, 1, 5, 9, 13, 2, 6, 10, 14, 3, 7, 11, 15]], ["CA", 7, 8, 11], ["CHR", 6, "shared", [7]], ["CA", 7, 8, 13], ["CI", 6], ["CHR", 5, "shared", [8]], ["CA", 6, 9, 13], ["CHR", 4, "shared", [12]], ["CA", 5, 13, 12], ["AN", 4, 0, 1], ["AN", 4, 1, 1], ["SP", 4, 2, 16, [2], 1], ["SP", 4, 4, 512, [1], 1], ["AN", 4, 6, 1], ["AN", 4, 7, 1], ["RE", 4, [2, 4, 3, 5, 0, 1, 6, 7]], ["CI", 3], ["CA", 2, 4, 3], ["CI", 1], ["FU", 24, [0, 1, 2, 3]], ["SP", 24, 0, 25088, [8], 1], ["AN", 24, 0, 5], ["AN", 24, 1, 6], ["FU", 16, [0, 1, 2, 3]], ["SP", 16, 0, 8192, [8], 1], ["AN", 16, 0, 5], ["AN", 16, 1, 6], ["FU", 14, [0, 1, 2, 3]], ["AN", 14, 0, 5], ["FU", 14, [1, 2, 3, 4]], ["AN", 14, 1, 4], ["FU", 14, [2, 3, 4, 5]], ["AN", 14, 2, 6], ["FU", 12, [0, 1, 2, 3]], ["SP", 12, 0, 32, [1], 1], ["AN", 12, 1, 2], ["FFSP", 12, 0, [16, 15, 14, 13], 1, 1], ["AN", 12, 1, 6], ["FU", 11, [0, 1, 2, 3]], ["AN", 11, 0, 5], ["FU", 11, [1, 2, 3, 4]], ["AN", 11, 1, 4], ["FU", 11, [2, 3, 4, 5]], ["AN", 11, 2, 6], ["FU", 9, [0, 1]], ["SP", 9, 0, 12, [1], 1], ["AN", 9, 1, 2], ["FFSP", 9, 0, [31, 30, 29, 28], 1, 1], ["AN", 9, 1, 6], ["FU", 7, [0, 1, 2, 3]], ["SP", 7, 0, 144, [1], 1], ["AN", 7, 1, 2], ["FFSP", 7, 0, [31, 30, 29, 28], 1, 1], ["AN", 7, 1, 6], ["FU", 5, [0, 1, 2, 3]], ["SP", 5, 0, 64, [1], 1], ["AN", 5, 1, 2], ["FFSP", 5, 0, [16, 15, 14, 13], 1, 1], ["AN", 5, 1, 6], ["FU", 4, [0, 1, 2, 3]], ["SP", 4, 0, 8192, [8], 1], ["AN", 4, 0, 5], ["AN", 4, 1, 6], ["PR", 4, 0, "auto_unroll_max_step$64"], ["PR", 10, 0, "auto_unroll_max_step$1024"], ["PR", 13, 0, "auto_unroll_max_step$0"], ["PR", 16, 0, "auto_unroll_max_step$512"]]]], "r": [[0.0275419], 0, 3.09457, 1648548689], "v": "v0.6"}
{"i": [["[\"fa4c3d5eeba4788b97d02196b9eace76\", [1, 7, 7, 512], [3, 3, 512, 512], [1, 7, 7, 512], [1, 1, 1, 512], [1, 1, 1, 512], [1, 7, 7, 512]]", "metal -keys=metal,gpu -max_function_args=31 -max_num_threads=256 -thread_warp_size=16", [-1, 16, 64, 32768, 2147483647, 1024, 2, 8], "llvm -keys=cpu -link-params=0 -mcpu=apple-m1 -mtriple=arm64-apple-darwin21.3.0", 0, []], [[], [["CI", 17], ["CI", 15], ["CI", 13], ["CI", 11], ["AN", 10, 0, 1], ["AN", 10, 1, 1], ["SP", 10, 2, 16, [2], 1], ["SP", 10, 4, 512, [8], 1], ["AN", 10, 6, 1], ["AN", 10, 7, 1], ["RE", 10, [2, 4, 3, 5, 0, 1, 6, 7]], ["CI", 9], ["CHW", 8, "local"], ["SP", 8, 0, 4, [1, 1, 2, 1], 1], ["SP", 8, 5, 4, [1, 1, 1, 1], 1], ["SP", 8, 10, 16, [1, 4, 2, 2], 1], ["SP", 8, 15, 512, [1, 4, 1, 4], 1], ["SP", 8, 20, 512, [2, 1], 1], ["RE", 8, [0, 5, 10, 15, 1, 6, 11, 16, 2, 7, 12, 17, 20, 21, 3, 8, 13, 18, 22, 4, 9, 14, 19]], ["FSP", 9, 0, 13, 3], ["FSP", 9, 4, 14, 3], ["FSP", 9, 8, 15, 3], ["FSP", 9, 12, 16, 3], ["RE", 9, [0, 4, 8, 12, 1, 5, 9, 13, 2, 6, 10, 14, 3, 7, 11, 15]], ["CA", 8, 9, 11], ["CHR", 7, "shared", [8]], ["CA", 8, 9, 12], ["CHW", 7, "local"], ["SP", 7, 0, 4, [2, 1, 2, 1], 1], ["SP", 7, 5, 4, [1, 1, 1, 4], 1], ["SP", 7, 10, 512, [1, 32, 2, 1], 1], ["SP", 7, 15, 512, [1, 2, 1, 2], 1], ["SP", 7, 20, 3, [1, 1], 1], ["SP", 7, 23, 3, [3, 1], 1], ["RE", 7, [0, 5, 10, 15, 1, 6, 11, 16, 2, 7, 12, 17, 20, 23, 21, 24, 3, 8, 13, 18, 22, 25, 4, 9, 14, 19]], ["FSP", 8, 0, 28, 3], ["FSP", 8, 4, 29, 3], ["FSP", 8, 8, 30, 3], ["FSP", 8, 12, 31, 3], ["RE", 8, [0, 4, 8, 12, 1, 5, 9, 13, 2, 6, 10, 14, 3, 7, 11, 15]], ["CA", 7, 8, 11], ["CHR", 6, "shared", [7]], ["CA", 7, 8, 13], ["CI", 6], ["CHR", 5, "shared", [8]], ["CA", 6, 9, 13], ["CHR", 4, "shared", [12]], ["CA", 5, 13, 12], ["AN", 4, 0, 1], ["AN", 4, 1, 1], ["SP", 4, 2, 16, [1], 1], ["SP", 4, 4, 512, [16], 1], ["AN", 4, 6, 1], ["AN", 4, 7, 1], ["RE", 4, [2, 4, 3, 5, 0, 1, 6, 7]], ["CI", 3], ["CA", 2, 4, 3], ["CI", 1], ["FU", 24, [0, 1, 2, 3]], ["SP", 24, 0, 25088, [8], 1], ["AN", 24, 0, 5], ["AN", 24, 1, 6], ["FU", 16, [0, 1, 2, 3]], ["SP", 16, 0, 8192, [8], 1], ["AN", 16, 0, 5], ["AN", 16, 1, 6], ["FU", 14, [0, 1, 2, 3]], ["AN", 14, 0, 5], ["FU", 14, [1, 2, 3, 4]], ["AN", 14, 1, 4], ["FU", 14, [2, 3, 4, 5]], ["AN", 14, 2, 6], ["FU", 12, [0, 1, 2, 3]], ["SP", 12, 0, 16, [1], 1], ["AN", 12, 1, 2], ["FFSP", 12, 0, [16, 15, 14, 13], 1, 1], ["AN", 12, 1, 6], ["FU", 11, [0, 1, 2, 3]], ["AN", 11, 0, 5], ["FU", 11, [1, 2, 3, 4]], ["AN", 11, 1, 4], ["FU", 11, [2, 3, 4, 5]], ["AN", 11, 2, 6], ["FU", 9, [0, 1]], ["SP", 9, 0, 12, [1], 1], ["AN", 9, 1, 2], ["FFSP", 9, 0, [31, 30, 29, 28], 1, 1], ["AN", 9, 1, 6], ["FU", 7, [0, 1, 2, 3]], ["SP", 7, 0, 12, [1], 1], ["AN", 7, 1, 2], ["FFSP", 7, 0, [31, 30, 29, 28], 1, 1], ["AN", 7, 1, 6], ["FU", 5, [0, 1, 2, 3]], ["SP", 5, 0, 16, [1], 1], ["AN", 5, 1, 2], ["FFSP", 5, 0, [16, 15, 14, 13], 1, 1], ["AN", 5, 1, 6], ["FU", 4, [0, 1, 2, 3]], ["SP", 4, 0, 8192, [8], 1], ["AN", 4, 0, 5], ["AN", 4, 1, 6], ["PR", 4, 0, "auto_unroll_max_step$16"], ["PR", 10, 0, "auto_unroll_max_step$16"], ["PR", 13, 0, "auto_unroll_max_step$16"], ["PR", 16, 0, "auto_unroll_max_step$16"]]]], "r": [[0.00144803], 0, 2.01318, 1648548691], "v": "v0.6"}
{"i": [["[\"fa4c3d5eeba4788b97d02196b9eace76\", [1, 7, 7, 512], [3, 3, 512, 512], [1, 7, 7, 512], [1, 1, 1, 512], [1, 1, 1, 512], [1, 7, 7, 512]]", "metal -keys=metal,gpu -max_function_args=31 -max_num_threads=256 -thread_warp_size=16", [-1, 16, 64, 32768, 2147483647, 1024, 2, 8], "llvm -keys=cpu -link-params=0 -mcpu=apple-m1 -mtriple=arm64-apple-darwin21.3.0", 0, []], [[], [["CI", 17], ["CI", 15], ["CI", 13], ["CI", 11], ["AN", 10, 0, 1], ["AN", 10, 1, 1], ["SP", 10, 2, 16, [1], 1], ["SP", 10, 4, 512, [8], 1], ["AN", 10, 6, 1], ["AN", 10, 7, 1], ["RE", 10, [2, 4, 3, 5, 0, 1, 6, 7]], ["CI", 9], ["CHW", 8, "local"], ["SP", 8, 0, 4, [1, 1, 2, 1], 1], ["SP", 8, 5, 4, [1, 1, 1, 1], 1], ["SP", 8, 10, 16, [1, 1, 16, 1], 1], ["SP", 8, 15, 512, [1, 32, 1, 1], 1], ["SP", 8, 20, 512, [8, 2], 1], ["RE", 8, [0, 5, 10, 15, 1, 6, 11, 16, 2, 7, 12, 17, 20, 21, 3, 8, 13, 18, 22, 4, 9, 14, 19]], ["FSP", 9, 0, 13, 3], ["FSP", 9, 4, 14, 3], ["FSP", 9, 8, 15, 3], ["FSP", 9, 12, 16, 3], ["RE", 9, [0, 4, 8, 12, 1, 5, 9, 13, 2, 6, 10, 14, 3, 7, 11, 15]], ["CA", 8, 9, 11], ["CHR", 7, "shared", [8]], ["CA", 8, 9, 12], ["CHW", 7, "local"], ["SP", 7, 0, 4, [1, 1, 2, 2], 1], ["SP", 7, 5, 4, [1, 1, 1, 1], 1], ["SP", 7, 10, 512, [1, 16, 4, 1], 1], ["SP", 7, 15, 512, [1, 1, 8, 1], 1], ["SP", 7, 20, 3, [1, 1], 1], ["SP", 7, 23, 3, [3, 1], 1], ["RE", 7, [0, 5, 10, 15, 1, 6, 11, 16, 2, 7, 12, 17, 20, 23, 21, 24, 3, 8, 13, 18, 22, 25, 4, 9, 14, 19]], ["FSP", 8, 0, 28, 3], ["FSP", 8, 4, 29, 3], ["FSP", 8, 8, 30, 3], ["FSP", 8, 12, 31, 3], ["RE", 8, [0, 4, 8, 12, 1, 5, 9, 13, 2, 6, 10, 14, 3, 7, 11, 15]], ["CA", 7, 8, 11], ["CHR", 6, "shared", [7]], ["CA", 7, 8, 13], ["CI", 6], ["CHR", 5, "shared", [8]], ["CA", 6, 9, 13], ["CHR", 4, "shared", [12]], ["CA", 5, 13, 12], ["AN", 4, 0, 1], ["AN", 4, 1, 1], ["SP", 4, 2, 16, [4], 1], ["SP", 4, 4, 512, [64], 1], ["AN", 4, 6, 1], ["AN", 4, 7, 1], ["RE", 4, [2, 4, 3, 5, 0, 1, 6, 7]], ["CI", 3], ["CA", 2, 4, 3], ["CI", 1], ["FU", 24, [0, 1, 2, 3]], ["SP", 24, 0, 25088, [8], 1], ["AN", 24, 0, 5], ["AN", 24, 1, 6], ["FU", 16, [0, 1, 2, 3]], ["SP", 16, 0, 8192, [8], 1], ["AN", 16, 0, 5], ["AN", 16, 1, 6], ["FU", 14, [0, 1, 2, 3]], ["AN", 14, 0, 5], ["FU", 14, [1, 2, 3, 4]], ["AN", 14, 1, 4], ["FU", 14, [2, 3, 4, 5]], ["AN", 14, 2, 6], ["FU", 12, [0, 1, 2, 3]], ["SP", 12, 0, 32, [1], 1], ["AN", 12, 1, 2], ["FFSP", 12, 0, [16, 15, 14, 13], 1, 1], ["AN", 12, 1, 6], ["FU", 11, [0, 1, 2, 3]], ["AN", 11, 0, 5], ["FU", 11, [1, 2, 3, 4]], ["AN", 11, 1, 4], ["FU", 11, [2, 3, 4, 5]], ["AN", 11, 2, 6], ["FU", 9, [0, 1]], ["SP", 9, 0, 12, [1], 1], ["AN", 9, 1, 2], ["FFSP", 9, 0, [31, 30, 29, 28], 1, 1], ["AN", 9, 1, 6], ["FU", 7, [0, 1, 2, 3]], ["SP", 7, 0, 96, [1], 1], ["AN", 7, 1, 2], ["FFSP", 7, 0, [31, 30, 29, 28], 1, 1], ["AN", 7, 1, 6], ["FU", 5, [0, 1, 2, 3]], ["SP", 5, 0, 512, [1], 1], ["AN", 5, 1, 2], ["FFSP", 5, 0, [16, 15, 14, 13], 1, 1], ["AN", 5, 1, 6], ["FU", 4, [0, 1, 2, 3]], ["SP", 4, 0, 8192, [8], 1], ["AN", 4, 0, 5], ["AN", 4, 1, 6], ["PR", 4, 0, "auto_unroll_max_step$64"], ["PR", 10, 0, "auto_unroll_max_step$1024"], ["PR", 13, 0, "auto_unroll_max_step$16"], ["PR", 16, 0, "auto_unroll_max_step$64"]]]], "r": [[0.00343504], 0, 2.18022, 1648548693], "v": "v0.6"}
{"i": [["[\"fa4c3d5eeba4788b97d02196b9eace76\", [1, 7, 7, 512], [3, 3, 512, 512], [1, 7, 7, 512], [1, 1, 1, 512], [1, 1, 1, 512], [1, 7, 7, 512]]", "metal -keys=metal,gpu -max_function_args=31 -max_num_threads=256 -thread_warp_size=16", [-1, 16, 64, 32768, 2147483647, 1024, 2, 8], "llvm -keys=cpu -link-params=0 -mcpu=apple-m1 -mtriple=arm64-apple-darwin21.3.0", 0, []], [[], [["CI", 17], ["CI", 15], ["CI", 13], ["CI", 11], ["AN", 10, 0, 1], ["AN", 10, 1, 1], ["SP", 10, 2, 16, [8], 1], ["SP", 10, 4, 512, [16], 1], ["AN", 10, 6, 1], ["AN", 10, 7, 1], ["RE", 10, [2, 4, 3, 5, 0, 1, 6, 7]], ["CI", 9], ["CHW", 8, "local"], ["SP", 8, 0, 4, [1, 1, 1, 2], 1], ["SP", 8, 5, 4, [1, 1, 2, 1], 1], ["SP", 8, 10, 16, [1, 4, 4, 1], 1], ["SP", 8, 15, 512, [1, 32, 2, 1], 1], ["SP", 8, 20, 512, [1, 4], 1], ["RE", 8, [0, 5, 10, 15, 1, 6, 11, 16, 2, 7, 12, 17, 20, 21, 3, 8, 13, 18, 22, 4, 9, 14, 19]], ["FSP", 9, 0, 13, 3], ["FSP", 9, 4, 14, 3], ["FSP", 9, 8, 15, 3], ["FSP", 9, 12, 16, 3], ["RE", 9, [0, 4, 8, 12, 1, 5, 9, 13, 2, 6, 10, 14, 3, 7, 11, 15]], ["CA", 8, 9, 11], ["CHR", 7, "shared", [8]], ["CA", 8, 9, 12], ["CHW", 7, "local"], ["SP", 7, 0, 4, [2, 2, 1, 1], 1], ["SP", 7, 5, 4, [1, 4, 1, 1], 1], ["SP", 7, 10, 512, [1, 2, 1, 64], 1], ["SP", 7, 15, 512, [1, 2, 2, 2], 1], ["SP", 7, 20, 3, [3, 1], 1], ["SP", 7, 23, 3, [1, 1], 1], ["RE", 7, [0, 5, 10, 15, 1, 6, 11, 16, 2, 7, 12, 17, 20, 23, 21, 24, 3, 8, 13, 18, 22, 25, 4, 9, 14, 19]], ["FSP", 8, 0, 28, 3], ["FSP", 8, 4, 29, 3], ["FSP", 8, 8, 30, 3], ["FSP", 8, 12, 31, 3], ["RE", 8, [0, 4, 8, 12, 1, 5, 9, 13, 2, 6, 10, 14, 3, 7, 11, 15]], ["CA", 7, 8, 11], ["CHR", 6, "shared", [7]], ["CA", 7, 8, 13], ["CI", 6], ["CHR", 5, "shared", [8]], ["CA", 6, 9, 13], ["CHR", 4, "shared", [12]], ["CA", 5, 13, 12], ["AN", 4, 0, 1], ["AN", 4, 1, 1], ["SP", 4, 2, 16, [1], 1], ["SP", 4, 4, 512, [4], 1], ["AN", 4, 6, 1], ["AN", 4, 7, 1], ["RE", 4, [2, 4, 3, 5, 0, 1, 6, 7]], ["CI", 3], ["CA", 2, 4, 3], ["CI", 1], ["FU", 24, [0, 1, 2, 3]], ["SP", 24, 0, 25088, [8], 1], ["AN", 24, 0, 5], ["AN", 24, 1, 6], ["FU", 16, [0, 1, 2, 3]], ["SP", 16, 0, 8192, [8], 1], ["AN", 16, 0, 5], ["AN", 16, 1, 6], ["FU", 14, [0, 1, 2, 3]], ["AN", 14, 0, 5], ["FU", 14, [1, 2, 3, 4]], ["AN", 14, 1, 4], ["FU", 14, [2, 3, 4, 5]], ["AN", 14, 2, 6], ["FU", 12, [0, 1, 2, 3]], ["SP", 12, 0, 8, [1], 1], ["AN", 12, 1, 2], ["FFSP", 12, 0, [16, 15, 14, 13], 1, 1], ["AN", 12, 1, 6], ["FU", 11, [0, 1, 2, 3]], ["AN", 11, 0, 5], ["FU", 11, [1, 2, 3, 4]], ["AN", 11, 1, 4], ["FU", 11, [2, 3, 4, 5]], ["AN", 11, 2, 6], ["FU", 9, [0, 1]], ["SP", 9, 0, 0, [1], 1], ["AN", 9, 1, 2], ["FFSP", 9, 0, [31, 30, 29, 28], 1, 1], ["AN", 9, 1, 6], ["FU", 7, [0, 1, 2, 3]], ["SP", 7, 0, 768, [1], 1], ["AN", 7, 1, 2], ["FFSP", 7, 0, [31, 30, 29, 28], 1, 1], ["AN", 7, 1, 6], ["FU", 5, [0, 1, 2, 3]], ["SP", 5, 0, 16, [1], 1], ["AN", 5, 1, 2], ["FFSP", 5, 0, [16, 15, 14, 13], 1, 1], ["AN", 5, 1, 6], ["FU", 4, [0, 1, 2, 3]], ["SP", 4, 0, 8192, [8], 1], ["AN", 4, 0, 5], ["AN", 4, 1, 6], ["PR", 4, 0, "auto_unroll_max_step$64"], ["PR", 10, 0, "auto_unroll_max_step$0"], ["PR", 13, 0, "auto_unroll_max_step$64"], ["PR", 16, 0, "auto_unroll_max_step$1024"]]]], "r": [[0.00461782], 0, 1.86256, 1648548694], "v": "v0.6"}
{"i": [["[\"fa4c3d5eeba4788b97d02196b9eace76\", [1, 7, 7, 512], [3, 3, 512, 512], [1, 7, 7, 512], [1, 1, 1, 512], [1, 1, 1, 512], [1, 7, 7, 512]]", "metal -keys=metal,gpu -max_function_args=31 -max_num_threads=256 -thread_warp_size=16", [-1, 16, 64, 32768, 2147483647, 1024, 2, 8], "llvm -keys=cpu -link-params=0 -mcpu=apple-m1 -mtriple=arm64-apple-darwin21.3.0", 0, []], [[], [["CI", 17], ["CI", 15], ["CI", 13], ["CI", 11], ["AN", 10, 0, 1], ["AN", 10, 1, 1], ["SP", 10, 2, 16, [2], 1], ["SP", 10, 4, 512, [8], 1], ["AN", 10, 6, 1], ["AN", 10, 7, 1], ["RE", 10, [2, 4, 3, 5, 0, 1, 6, 7]], ["CI", 9], ["CHW", 8, "local"], ["SP", 8, 0, 4, [1, 1, 2, 1], 1], ["SP", 8, 5, 4, [1, 1, 1, 1], 1], ["SP", 8, 10, 16, [1, 4, 2, 2], 1], ["SP", 8, 15, 512, [1, 4, 1, 4], 1], ["SP", 8, 20, 512, [2, 1], 1], ["RE", 8, [0, 5, 10, 15, 1, 6, 11, 16, 2, 7, 12, 17, 20, 21, 3, 8, 13, 18, 22, 4, 9, 14, 19]], ["FSP", 9, 0, 13, 3], ["FSP", 9, 4, 14, 3], ["FSP", 9, 8, 15, 3], ["FSP", 9, 12, 16, 3], ["RE", 9, [0, 4, 8, 12, 1, 5, 9, 13, 2, 6, 10, 14, 3, 7, 11, 15]], ["CA", 8, 9, 11], ["CHR", 7, "shared", [8]], ["CA", 8, 9, 12], ["CHW", 7, "local"], ["SP", 7, 0, 4, [2, 1, 1, 1], 1], ["SP", 7, 5, 4, [1, 1, 1, 4], 1], ["SP", 7, 10, 512, [1, 32, 2, 1], 1], ["SP", 7, 15, 512, [1, 2, 1, 2], 1], ["SP", 7, 20, 3, [1, 1], 1], ["SP", 7, 23, 3, [1, 3], 1], ["RE", 7, [0, 5, 10, 15, 1, 6, 11, 16, 2, 7, 12, 17, 20, 23, 21, 24, 3, 8, 13, 18, 22, 25, 4, 9, 14, 19]], ["FSP", 8, 0, 28, 3], ["FSP", 8, 4, 29, 3], ["FSP", 8, 8, 30, 3], ["FSP", 8, 12, 31, 3], ["RE", 8, [0, 4, 8, 12, 1, 5, 9, 13, 2, 6, 10, 14, 3, 7, 11, 15]], ["CA", 7, 8, 11], ["CHR", 6, "shared", [7]], ["CA", 7, 8, 13], ["CI", 6], ["CHR", 5, "shared", [8]], ["CA", 6, 9, 13], ["CHR", 4, "shared", [12]], ["CA", 5, 13, 12], ["AN", 4, 0, 1], ["AN", 4, 1, 1], ["SP", 4, 2, 16, [1], 1], ["SP", 4, 4, 512, [32], 1], ["AN", 4, 6, 1], ["AN", 4, 7, 1], ["RE", 4, [2, 4, 3, 5, 0, 1, 6, 7]], ["CI", 3], ["CA", 2, 4, 3], ["CI", 1], ["FU", 24, [0, 1, 2, 3]], ["SP", 24, 0, 25088, [8], 1], ["AN", 24, 0, 5], ["AN", 24, 1, 6], ["FU", 16, [0, 1, 2, 3]], ["SP", 16, 0, 8192, [8], 1], ["AN", 16, 0, 5], ["AN", 16, 1, 6], ["FU", 14, [0, 1, 2, 3]], ["AN", 14, 0, 5], ["FU", 14, [1, 2, 3, 4]], ["AN", 14, 1, 4], ["FU", 14, [2, 3, 4, 5]], ["AN", 14, 2, 6], ["FU", 12, [0, 1, 2, 3]], ["SP", 12, 0, 16, [1], 1], ["AN", 12, 1, 2], ["FFSP", 12, 0, [16, 15, 14, 13], 1, 1], ["AN", 12, 1, 6], ["FU", 11, [0, 1, 2, 3]], ["AN", 11, 0, 5], ["FU", 11, [1, 2, 3, 4]], ["AN", 11, 1, 4], ["FU", 11, [2, 3, 4, 5]], ["AN", 11, 2, 6], ["FU", 9, [0, 1]], ["SP", 9, 0, 12, [1], 1], ["AN", 9, 1, 2], ["FFSP", 9, 0, [31, 30, 29, 28], 1, 1], ["AN", 9, 1, 6], ["FU", 7, [0, 1, 2, 3]], ["SP", 7, 0, 12, [1], 1], ["AN", 7, 1, 2], ["FFSP", 7, 0, [31, 30, 29, 28], 1, 1], ["AN", 7, 1, 6], ["FU", 5, [0, 1, 2, 3]], ["SP", 5, 0, 16, [1], 1], ["AN", 5, 1, 2], ["FFSP", 5, 0, [16, 15, 14, 13], 1, 1], ["AN", 5, 1, 6], ["FU", 4, [0, 1, 2, 3]], ["SP", 4, 0, 8192, [8], 1], ["AN", 4, 0, 5], ["AN", 4, 1, 6], ["PR", 4, 0, "auto_unroll_max_step$16"], ["PR", 10, 0, "auto_unroll_max_step$16"], ["PR", 13, 0, "auto_unroll_max_step$16"], ["PR", 16, 0, "auto_unroll_max_step$16"]]]], "r": [[0.00145557], 0, 1.48583, 1648548695], "v": "v0.6"}
{"i": [["[\"fa4c3d5eeba4788b97d02196b9eace76\", [1, 7, 7, 512], [3, 3, 512, 512], [1, 7, 7, 512], [1, 1, 1, 512], [1, 1, 1, 512], [1, 7, 7, 512]]", "metal -keys=metal,gpu -max_function_args=31 -max_num_threads=256 -thread_warp_size=16", [-1, 16, 64, 32768, 2147483647, 1024, 2, 8], "llvm -keys=cpu -link-params=0 -mcpu=apple-m1 -mtriple=arm64-apple-darwin21.3.0", 0, []], [[], [["CI", 17], ["CI", 15], ["CI", 13], ["CI", 11], ["AN", 10, 0, 1], ["AN", 10, 1, 1], ["SP", 10, 2, 16, [2], 1], ["SP", 10, 4, 512, [32], 1], ["AN", 10, 6, 1], ["AN", 10, 7, 1], ["RE", 10, [2, 4, 3, 5, 0, 1, 6, 7]], ["CI", 9], ["CHW", 8, "local"], ["SP", 8, 0, 4, [1, 4, 1, 1], 1], ["SP", 8, 5, 4, [1, 1, 1, 1], 1], ["SP", 8, 10, 16, [1, 1, 1, 2], 1], ["SP", 8, 15, 512, [1, 4, 4, 2], 1], ["SP", 8, 20, 512, [1, 8], 1], ["RE", 8, [0, 5, 10, 15, 1, 6, 11, 16, 2, 7, 12, 17, 20, 21, 3, 8, 13, 18, 22, 4, 9, 14, 19]], ["FSP", 9, 0, 13, 3], ["FSP", 9, 4, 14, 3], ["FSP", 9, 8, 15, 3], ["FSP", 9, 12, 16, 3], ["RE", 9, [0, 4, 8, 12, 1, 5, 9, 13, 2, 6, 10, 14, 3, 7, 11, 15]], ["CA", 8, 9, 11], ["CHR", 7, "shared", [8]], ["CA", 8, 9, 12], ["CHW", 7, "local"], ["SP", 7, 0, 4, [1, 1, 1, 4], 1], ["SP", 7, 5, 4, [2, 1, 1, 1], 1], ["SP", 7, 10, 512, [1, 8, 2, 1], 1], ["SP", 7, 15, 512, [1, 4, 4, 1], 1], ["SP", 7, 20, 3, [1, 1], 1], ["SP", 7, 23, 3, [1, 3], 1], ["RE", 7, [0, 5, 10, 15, 1, 6, 11, 16, 2, 7, 12, 17, 20, 23, 21, 24, 3, 8, 13, 18, 22, 25, 4, 9, 14, 19]], ["FSP", 8, 0, 28, 3], ["FSP", 8, 4, 29, 3], ["FSP", 8, 8, 30, 3], ["FSP", 8, 12, 31, 3], ["RE", 8, [0, 4, 8, 12, 1, 5, 9, 13, 2, 6, 10, 14, 3, 7, 11, 15]], ["CA", 7, 8, 11], ["CHR", 6, "shared", [7]], ["CA", 7, 8, 13], ["CI", 6], ["CHR", 5, "shared", [8]], ["CA", 6, 9, 13], ["CHR", 4, "shared", [12]], ["CA", 5, 13, 12], ["AN", 4, 0, 1], ["AN", 4, 1, 1], ["SP", 4, 2, 16, [8], 1], ["SP", 4, 4, 512, [1], 1], ["AN", 4, 6, 1], ["AN", 4, 7, 1], ["RE", 4, [2, 4, 3, 5, 0, 1, 6, 7]], ["CI", 3], ["CA", 2, 4, 3], ["CI", 1], ["FU", 24, [0, 1, 2, 3]], ["SP", 24, 0, 25088, [8], 1], ["AN", 24, 0, 5], ["AN", 24, 1, 6], ["FU", 16, [0, 1, 2, 3]], ["SP", 16, 0, 8192, [8], 1], ["AN", 16, 0, 5], ["AN", 16, 1, 6], ["FU", 14, [0, 1, 2, 3]], ["AN", 14, 0, 5], ["FU", 14, [1, 2, 3, 4]], ["AN", 14, 1, 4], ["FU", 14, [2, 3, 4, 5]], ["AN", 14, 2, 6], ["FU", 12, [0, 1, 2, 3]], ["SP", 12, 0, 64, [1], 1], ["AN", 12, 1, 2], ["FFSP", 12, 0, [16, 15, 14, 13], 1, 1], ["AN", 12, 1, 6], ["FU", 11, [0, 1, 2, 3]], ["AN", 11, 0, 5], ["FU", 11, [1, 2, 3, 4]], ["AN", 11, 1, 4], ["FU", 11, [2, 3, 4, 5]], ["AN", 11, 2, 6], ["FU", 9, [0, 1]], ["SP", 9, 0, 12, [1], 1], ["AN", 9, 1, 2], ["FFSP", 9, 0, [31, 30, 29, 28], 1, 1], ["AN", 9, 1, 6], ["FU", 7, [0, 1, 2, 3]], ["SP", 7, 0, 24, [1], 1], ["AN", 7, 1, 2], ["FFSP", 7, 0, [31, 30, 29, 28], 1, 1], ["AN", 7, 1, 6], ["FU", 5, [0, 1, 2, 3]], ["SP", 5, 0, 16, [1], 1], ["AN", 5, 1, 2], ["FFSP", 5, 0, [16, 15, 14, 13], 1, 1], ["AN", 5, 1, 6], ["FU", 4, [0, 1, 2, 3]], ["SP", 4, 0, 8192, [8], 1], ["AN", 4, 0, 5], ["AN", 4, 1, 6], ["PR", 4, 0, "auto_unroll_max_step$0"], ["PR", 10, 0, "auto_unroll_max_step$0"], ["PR", 13, 0, "auto_unroll_max_step$16"], ["PR", 16, 0, "auto_unroll_max_step$16"]]]], "r": [[0.00267851], 0, 2.00656, 1648548703], "v": "v0.6"}
{"i": [["[\"fa4c3d5eeba4788b97d02196b9eace76\", [1, 7, 7, 512], [3, 3, 512, 512], [1, 7, 7, 512], [1, 1, 1, 512], [1, 1, 1, 512], [1, 7, 7, 512]]", "metal -keys=metal,gpu -max_function_args=31 -max_num_threads=256 -thread_warp_size=16", [-1, 16, 64, 32768, 2147483647, 1024, 2, 8], "llvm -keys=cpu -link-params=0 -mcpu=apple-m1 -mtriple=arm64-apple-darwin21.3.0", 0, []], [[], [["CI", 17], ["CI", 15], ["CI", 13], ["CI", 11], ["AN", 10, 0, 1], ["AN", 10, 1, 1], ["SP", 10, 2, 16, [2], 1], ["SP", 10, 4, 512, [2], 1], ["AN", 10, 6, 1], ["AN", 10, 7, 1], ["RE", 10, [2, 4, 3, 5, 0, 1, 6, 7]], ["CI", 9], ["CHW", 8, "local"], ["SP", 8, 0, 4, [1, 2, 1, 1], 1], ["SP", 8, 5, 4, [1, 1, 4, 1], 1], ["SP", 8, 10, 16, [1, 1, 2, 2], 1], ["SP", 8, 15, 512, [2, 4, 2, 8], 1], ["SP", 8, 20, 512, [1, 1], 1], ["RE", 8, [0, 5, 10, 15, 1, 6, 11, 16, 2, 7, 12, 17, 20, 21, 3, 8, 13, 18, 22, 4, 9, 14, 19]], ["FSP", 9, 0, 13, 3], ["FSP", 9, 4, 14, 3], ["FSP", 9, 8, 15, 3], ["FSP", 9, 12, 16, 3], ["RE", 9, [0, 4, 8, 12, 1, 5, 9, 13, 2, 6, 10, 14, 3, 7, 11, 15]], ["CA", 8, 9, 11], ["CHR", 7, "shared", [8]], ["CA", 8, 9, 12], ["CHW", 7, "local"], ["SP", 7, 0, 4, [2, 1, 1, 2], 1], ["SP", 7, 5, 4, [1, 2, 2, 1], 1], ["SP", 7, 10, 512, [1, 8, 1, 32], 1], ["SP", 7, 15, 512, [1, 4, 1, 1], 1], ["SP", 7, 20, 3, [1, 1], 1], ["SP", 7, 23, 3, [1, 3], 1], ["RE", 7, [0, 5, 10, 15, 1, 6, 11, 16, 2, 7, 12, 17, 20, 23, 21, 24, 3, 8, 13, 18, 22, 25, 4, 9, 14, 19]], ["FSP", 8, 0, 28, 3], ["FSP", 8, 4, 29, 3], ["FSP", 8, 8, 30, 3], ["FSP", 8, 12, 31, 3], ["RE", 8, [0, 4, 8, 12, 1, 5, 9, 13, 2, 6, 10, 14, 3, 7, 11, 15]], ["CA", 7, 8, 11], ["CHR", 6, "shared", [7]], ["CA", 7, 8, 13], ["CI", 6], ["CHR", 5, "shared", [8]], ["CA", 6, 9, 13], ["CHR", 4, "shared", [12]], ["CA", 5, 13, 12], ["AN", 4, 0, 1], ["AN", 4, 1, 1], ["SP", 4, 2, 16, [8], 1], ["SP", 4, 4, 512, [1], 1], ["AN", 4, 6, 1], ["AN", 4, 7, 1], ["RE", 4, [2, 4, 3, 5, 0, 1, 6, 7]], ["CI", 3], ["CA", 2, 4, 3], ["CI", 1], ["FU", 24, [0, 1, 2, 3]], ["SP", 24, 0, 25088, [8], 1], ["AN", 24, 0, 5], ["AN", 24, 1, 6], ["FU", 16, [0, 1, 2, 3]], ["SP", 16, 0, 8192, [8], 1], ["AN", 16, 0, 5], ["AN", 16, 1, 6], ["FU", 14, [0, 1, 2, 3]], ["AN", 14, 0, 5], ["FU", 14, [1, 2, 3, 4]], ["AN", 14, 1, 4], ["FU", 14, [2, 3, 4, 5]], ["AN", 14, 2, 6], ["FU", 12, [0, 1, 2, 3]], ["SP", 12, 0, 64, [1], 1], ["AN", 12, 1, 2], ["FFSP", 12, 0, [16, 15, 14, 13], 1, 1], ["AN", 12, 1, 6], ["FU", 11, [0, 1, 2, 3]], ["AN", 11, 0, 5], ["FU", 11, [1, 2, 3, 4]], ["AN", 11, 1, 4], ["FU", 11, [2, 3, 4, 5]], ["AN", 11, 2, 6], ["FU", 9, [0, 1]], ["SP", 9, 0, 0, [1], 1], ["AN", 9, 1, 2], ["FFSP", 9, 0, [31, 30, 29, 28], 1, 1], ["AN", 9, 1, 6], ["FU", 7, [0, 1, 2, 3]], ["SP", 7, 0, 96, [1], 1], ["AN", 7, 1, 2], ["FFSP", 7, 0, [31, 30, 29, 28], 1, 1], ["AN", 7, 1, 6], ["FU", 5, [0, 1, 2, 3]], ["SP", 5, 0, 16, [1], 1], ["AN", 5, 1, 2], ["FFSP", 5, 0, [16, 15, 14, 13], 1, 1], ["AN", 5, 1, 6], ["FU", 4, [0, 1, 2, 3]], ["SP", 4, 0, 8192, [8], 1], ["AN", 4, 0, 5], ["AN", 4, 1, 6], ["PR", 4, 0, "auto_unroll_max_step$512"], ["PR", 10, 0, "auto_unroll_max_step$512"], ["PR", 13, 0, "auto_unroll_max_step$1024"], ["PR", 16, 0, "auto_unroll_max_step$0"]]]], "r": [[0.0206764], 0, 4.55602, 1648548705], "v": "v0.6"}
{"i": [["[\"fa4c3d5eeba4788b97d02196b9eace76\", [1, 7, 7, 512], [3, 3, 512, 512], [1, 7, 7, 512], [1, 1, 1, 512], [1, 1, 1, 512], [1, 7, 7, 512]]", "metal -keys=metal,gpu -max_function_args=31 -max_num_threads=256 -thread_warp_size=16", [-1, 16, 64, 32768, 2147483647, 1024, 2, 8], "llvm -keys=cpu -link-params=0 -mcpu=apple-m1 -mtriple=arm64-apple-darwin21.3.0", 0, []], [[], [["CI", 17], ["CI", 15], ["CI", 13], ["CI", 11], ["AN", 10, 0, 1], ["AN", 10, 1, 1], ["SP", 10, 2, 16, [2], 1], ["SP", 10, 4, 512, [32], 1], ["AN", 10, 6, 1], ["AN", 10, 7, 1], ["RE", 10, [2, 4, 3, 5, 0, 1, 6, 7]], ["CI", 9], ["CHW", 8, "local"], ["SP", 8, 0, 4, [1, 2, 1, 1], 1], ["SP", 8, 5, 4, [1, 1, 1, 1], 1], ["SP", 8, 10, 16, [1, 1, 1, 2], 1], ["SP", 8, 15, 512, [1, 4, 4, 2], 1], ["SP", 8, 20, 512, [1, 8], 1], ["RE", 8, [0, 5, 10, 15, 1, 6, 11, 16, 2, 7, 12, 17, 20, 21, 3, 8, 13, 18, 22, 4, 9, 14, 19]], ["FSP", 9, 0, 13, 3], ["FSP", 9, 4, 14, 3], ["FSP", 9, 8, 15, 3], ["FSP", 9, 12, 16, 3], ["RE", 9, [0, 4, 8, 12, 1, 5, 9, 13, 2, 6, 10, 14, 3, 7, 11, 15]], ["CA", 8, 9, 11], ["CHR", 7, "shared", [8]], ["CA", 8, 9, 12], ["CHW", 7, "local"], ["SP", 7, 0, 4, [1, 1, 1, 4], 1], ["SP", 7, 5, 4, [2, 1, 1, 1], 1], ["SP", 7, 10, 512, [2, 8, 1, 1], 1], ["SP", 7, 15, 512, [1, 4, 4, 1], 1], ["SP", 7, 20, 3, [1, 1], 1], ["SP", 7, 23, 3, [1, 3], 1], ["RE", 7, [0, 5, 10, 15, 1, 6, 11, 16, 2, 7, 12, 17, 20, 23, 21, 24, 3, 8, 13, 18, 22, 25, 4, 9, 14, 19]], ["FSP", 8, 0, 28, 3], ["FSP", 8, 4, 29, 3], ["FSP", 8, 8, 30, 3], ["FSP", 8, 12, 31, 3], ["RE", 8, [0, 4, 8, 12, 1, 5, 9, 13, 2, 6, 10, 14, 3, 7, 11, 15]], ["CA", 7, 8, 11], ["CHR", 6, "shared", [7]], ["CA", 7, 8, 13], ["CI", 6], ["CHR", 5, "shared", [8]], ["CA", 6, 9, 13], ["CHR", 4, "shared", [12]], ["CA", 5, 13, 12], ["AN", 4, 0, 1], ["AN", 4, 1, 1], ["SP", 4, 2, 16, [8], 1], ["SP", 4, 4, 512, [64], 1], ["AN", 4, 6, 1], ["AN", 4, 7, 1], ["RE", 4, [2, 4, 3, 5, 0, 1, 6, 7]], ["CI", 3], ["CA", 2, 4, 3], ["CI", 1], ["FU", 24, [0, 1, 2, 3]], ["SP", 24, 0, 25088, [2], 1], ["AN", 24, 0, 5], ["AN", 24, 1, 6], ["FU", 16, [0, 1, 2, 3]], ["SP", 16, 0, 8192, [8], 1], ["AN", 16, 0, 5], ["AN", 16, 1, 6], ["FU", 14, [0, 1, 2, 3]], ["AN", 14, 0, 5], ["FU", 14, [1, 2, 3, 4]], ["AN", 14, 1, 4], ["FU", 14, [2, 3, 4, 5]], ["AN", 14, 2, 6], ["FU", 12, [0, 1, 2, 3]], ["SP", 12, 0, 64, [1], 1], ["AN", 12, 1, 2], ["FFSP", 12, 0, [16, 15, 14, 13], 1, 1], ["AN", 12, 1, 6], ["FU", 11, [0, 1, 2, 3]], ["AN", 11, 0, 5], ["FU", 11, [1, 2, 3, 4]], ["AN", 11, 1, 4], ["FU", 11, [2, 3, 4, 5]], ["AN", 11, 2, 6], ["FU", 9, [0, 1]], ["SP", 9, 0, 12, [1], 1], ["AN", 9, 1, 2], ["FFSP", 9, 0, [31, 30, 29, 28], 1, 1], ["AN", 9, 1, 6], ["FU", 7, [0, 1, 2, 3]], ["SP", 7, 0, 24, [1], 1], ["AN", 7, 1, 2], ["FFSP", 7, 0, [31, 30, 29, 28], 1, 1], ["AN", 7, 1, 6], ["FU", 5, [0, 1, 2, 3]], ["SP", 5, 0, 16, [1], 1], ["AN", 5, 1, 2], ["FFSP", 5, 0, [16, 15, 14, 13], 1, 1], ["AN", 5, 1, 6], ["FU", 4, [0, 1, 2, 3]], ["SP", 4, 0, 8192, [8], 1], ["AN", 4, 0, 5], ["AN", 4, 1, 6], ["PR", 4, 0, "auto_unroll_max_step$0"], ["PR", 10, 0, "auto_unroll_max_step$0"], ["PR", 13, 0, "auto_unroll_max_step$16"], ["PR", 16, 0, "auto_unroll_max_step$16"]]]], "r": [[0.00305455], 0, 1.71773, 1648548707], "v": "v0.6"}
{"i": [["[\"fa4c3d5eeba4788b97d02196b9eace76\", [1, 7, 7, 512], [3, 3, 512, 512], [1, 7, 7, 512], [1, 1, 1, 512], [1, 1, 1, 512], [1, 7, 7, 512]]", "metal -keys=metal,gpu -max_function_args=31 -max_num_threads=256 -thread_warp_size=16", [-1, 16, 64, 32768, 2147483647, 1024, 2, 8], "llvm -keys=cpu -link-params=0 -mcpu=apple-m1 -mtriple=arm64-apple-darwin21.3.0", 0, []], [[], [["CI", 17], ["CI", 15], ["CI", 13], ["CI", 11], ["AN", 10, 0, 1], ["AN", 10, 1, 1], ["SP", 10, 2, 16, [2], 1], ["SP", 10, 4, 512, [1], 1], ["AN", 10, 6, 1], ["AN", 10, 7, 1], ["RE", 10, [2, 4, 3, 5, 0, 1, 6, 7]], ["CI", 9], ["CHW", 8, "local"], ["SP", 8, 0, 4, [1, 1, 1, 4], 1], ["SP", 8, 5, 4, [1, 4, 1, 1], 1], ["SP", 8, 10, 16, [2, 4, 1, 2], 1], ["SP", 8, 15, 512, [1, 16, 1, 16], 1], ["SP", 8, 20, 512, [1, 1], 1], ["RE", 8, [0, 5, 10, 15, 1, 6, 11, 16, 2, 7, 12, 17, 20, 21, 3, 8, 13, 18, 22, 4, 9, 14, 19]], ["FSP", 9, 0, 13, 3], ["FSP", 9, 4, 14, 3], ["FSP", 9, 8, 15, 3], ["FSP", 9, 12, 16, 3], ["RE", 9, [0, 4, 8, 12, 1, 5, 9, 13, 2, 6, 10, 14, 3, 7, 11, 15]], ["CA", 8, 9, 11], ["CHR", 7, "shared", [8]], ["CA", 8, 9, 12], ["CHW", 7, "local"], ["SP", 7, 0, 4, [1, 1, 1, 1], 1], ["SP", 7, 5, 4, [1, 1, 2, 2], 1], ["SP", 7, 10, 512, [2, 16, 2, 2], 1], ["SP", 7, 15, 512, [1, 2, 2, 2], 1], ["SP", 7, 20, 3, [3, 1], 1], ["SP", 7, 23, 3, [1, 1], 1], ["RE", 7, [0, 5, 10, 15, 1, 6, 11, 16, 2, 7, 12, 17, 20, 23, 21, 24, 3, 8, 13, 18, 22, 25, 4, 9, 14, 19]], ["FSP", 8, 0, 28, 3], ["FSP", 8, 4, 29, 3], ["FSP", 8, 8, 30, 3], ["FSP", 8, 12, 31, 3], ["RE", 8, [0, 4, 8, 12, 1, 5, 9, 13, 2, 6, 10, 14, 3, 7, 11, 15]], ["CA", 7, 8, 11], ["CHR", 6, "shared", [7]], ["CA", 7, 8, 13], ["CI", 6], ["CHR", 5, "shared", [8]], ["CA", 6, 9, 13], ["CHR", 4, "shared", [12]], ["CA", 5, 13, 12], ["AN", 4, 0, 1], ["AN", 4, 1, 1], ["SP", 4, 2, 16, [4], 1], ["SP", 4, 4, 512, [64], 1], ["AN", 4, 6, 1], ["AN", 4, 7, 1], ["RE", 4, [2, 4, 3, 5, 0, 1, 6, 7]], ["CI", 3], ["CA", 2, 4, 3], ["CI", 1], ["FU", 24, [0, 1, 2, 3]], ["SP", 24, 0, 25088, [8], 1], ["AN", 24, 0, 5], ["AN", 24, 1, 6], ["FU", 16, [0, 1, 2, 3]], ["SP", 16, 0, 8192, [8], 1], ["AN", 16, 0, 5], ["AN", 16, 1, 6], ["FU", 14, [0, 1, 2, 3]], ["AN", 14, 0, 5], ["FU", 14, [1, 2, 3, 4]], ["AN", 14, 1, 4], ["FU", 14, [2, 3, 4, 5]], ["AN", 14, 2, 6], ["FU", 12, [0, 1, 2, 3]], ["SP", 12, 0, 128, [1], 1], ["AN", 12, 1, 2], ["FFSP", 12, 0, [16, 15, 14, 13], 1, 1], ["AN", 12, 1, 6], ["FU", 11, [0, 1, 2, 3]], ["AN", 11, 0, 5], ["FU", 11, [1, 2, 3, 4]], ["AN", 11, 1, 4], ["FU", 11, [2, 3, 4, 5]], ["AN", 11, 2, 6], ["FU", 9, [0, 1]], ["SP", 9, 0, 12, [1], 1], ["AN", 9, 1, 2], ["FFSP", 9, 0, [31, 30, 29, 28], 1, 1], ["AN", 9, 1, 6], ["FU", 7, [0, 1, 2, 3]], ["SP", 7, 0, 48, [1], 1], ["AN", 7, 1, 2], ["FFSP", 7, 0, [31, 30, 29, 28], 1, 1], ["AN", 7, 1, 6], ["FU", 5, [0, 1, 2, 3]], ["SP", 5, 0, 8, [1], 1], ["AN", 5, 1, 2], ["FFSP", 5, 0, [16, 15, 14, 13], 1, 1], ["AN", 5, 1, 6], ["FU", 4, [0, 1, 2, 3]], ["SP", 4, 0, 8192, [8], 1], ["AN", 4, 0, 5], ["AN", 4, 1, 6], ["PR", 4, 0, "auto_unroll_max_step$512"], ["PR", 10, 0, "auto_unroll_max_step$1024"], ["PR", 13, 0, "auto_unroll_max_step$512"], ["PR", 16, 0, "auto_unroll_max_step$16"]]]], "r": [[0.0249527], 0, 2.95358, 1648548709], "v": "v0.6"}
